score,creation_date,body
0.0,2020-11-11 20:45:09.240000+00:00,"I'm implementing a bst, more precisely an AVL tree in c++. I got pretty much everything working except the balancing. The program will crash when it tries to balance LR or RL. For example if will crash if i insert 7, 5, 6 OR 7, 9, 8 but it will work with: 7, 6, 5 AND 7, 8, 9.
relevant code(pastebin): https://pastebin.com/cn69XLn5
relevant code:
all code (pastebin): https://pastebin.com/uxTQ369i
all code:
I'm not sure but I think that the problem is that I'm sending in the wrong node to the function, therefore it crashes because it assumes the node im sending in will have a child but it wont and therefore it tries to access a nullptr. I don't know how to fix this though"
1.0,2020-11-28 15:15:20+00:00,"I would like to adjust the return value of a method from an instance class and I am not quite sure if it is possible with or without Reflection. I could not figure it out and so I wanted to ask it here. Lets say I have for example the following class Foo:
Some context:
Foo class is from an external library
Foo class is not adjustable
Foo class is not extendable
So with this basic example I would like to get Bar returned from the method getName() instead of Foo. To be very explicit:
Why do I need this?
Well I need to pass this instance of Foo to another method which only accepts an object of the type Foo. This method will call the method getName() and will do some additional calculation.
Actual use case:
I will try to give more context, hopefully it will be a bit more clear. There is a method within a builder class which is accepting an instance of  a method called . This builder class will internally call  on the KeyManagerFactory and it will return 
The KeyManagerFactory is a final class, it doesn't have a public constructor at all. The getKeyManager method is also final. I already have a  and so I want to hack this KeyManagerFactory to return my own array own KeyManagers instead and supply it to the builder."
0.0,2020-11-03 19:20:41.983000+00:00,"In HackerRank's Array Reversal problem,I wrote a code like below and it works fine with these test cases:
n=7
1 13 15 20 12 13 2
But for only one test case it didn't work and gave me the error message I wrote in the title.(For this):
n=6
16 13 7 2 1 12
Here is my code"
0.0,2020-11-06 12:26:14.433000+00:00,"I want to convert the following DateTime to UNIX timestamp to compare with DateTime coming from python data.
1st DateTime from dataframe-
output1: str
2nd DateTime from MSSQL server-
output2: list
I want to compare output1 and output2 by converting to Unix timeStamp? any other method? because later on after comparing two DateTime, depend on the condition I want to update the database. Also welcome for a new approach to update database"
0.0,2020-11-11 12:14:24.510000+00:00,"We have SSIS packages and a SQL Server database. We have to migrate our data and packages to a new database, and our SSIS packages have been troublesome.
The packages are a SQL task -&gt; Data Flow Task -&gt; SQL Task -&gt; Script Task. SSMS is throwing an error on the script task. I do not have permissions to access the server directly and run VS from there. On my local machine, everything runs fine.
We determined that the script task is actually unnecessary in the process, so I deleted that step and re-deployed the packages. However, it's throwing the exact same script task error despite the script task not being there anymore.
If I recreate the package without the script task ever being involved, it runs just fine. I would need to recreate a huge amount of packages, so I'm trying to avoid this at all costs.
Does anybody have any ideas?"
0.0,2020-11-30 15:28:34.233000+00:00,"I need to get the following: 
I wrote the following:
but I got:"
3.0,2020-11-30 18:07:51.843000+00:00,"I've a PostgreSQL  table with this complex structure :
And I've to make a query for filter until the field40 many explication than I saw are for objects mor simple.
Can you explain me how can I do ?
Edit :
The example what I made i more simplest than reality. In reality the object is very very long. If I try to make a simple example with values, that's like that :
In this example, my Postgres table have two columns, one with the primary key uuid and one with the object in jsonb item
And what I want, for example is to make a filter on my items where &quot;field41&quot; contains value &quot;gis.stackexchange.com&quot; for et in this example if I search &quot;field41&quot; = &quot;https://yahoo.com/&quot; the tuple with &quot;uuid&quot; = &quot;uuid&quot;: &quot;64fc7a55-be2d-41d8-99c1-d08fa5780731&quot; will not be in the result"
3.0,2020-11-05 07:30:57.103000+00:00,"We have a table of 130GB and 4000 columns. When we select 2 of these columns, our Spark UI reports a total of 30GB read. However, if we select those two columns and store them as a separate dataset, the total size of the dataset is just 17MB. Given that parquet is columnar storage, something appears not to be working properly. I've found this question but I'm unsure how to diagnose further and what attempts to take to reduce the amount of I/O required.
It was my understanding that the benefit of columnar storage is that each column can be read more or less independently of each other.
We're running on Hadoop 2.7.X on Databricks. It occurs both on the 6.X and 7.X versions of databricks (spark 2.4/3.0)"
0.0,2020-11-02 11:22:12.923000+00:00,"I have the following code to create a role in my discord server:
I was wondering how I can enable the option below when creating a new role within my code:"
0.0,2020-11-19 18:13:33.217000+00:00,I am working in JavaScript/Node. I have a UUID using https://www.npmjs.com/package/uuid. I need to convert it to two 64-bit integers. Java has getLeastSignificantBits() and getMostSignificantBits(). Does anybody know if these utility functions have been ported to JavaScript/ECMA6?
1.0,2020-11-07 05:14:16.200000+00:00,"Prior to macOS Big Sur, I could create an  and hide the default show/hide arrows that expand and collapse groups of items. But now in Big Sur, I can't find any way to get rid of the default arrows. I'm using my own arrow style and functionality.
Here's a screenshot:
I have my  set to have a  Style since I also provide my own margins around the rows. But I don't see any options in the storyboard editor for hiding the arrows, nor do I see any options under  in the docs for doing it.
Does anyone know how to hide the default expand/collapse arrows in Big Sur?"
0.0,2020-11-13 14:07:03.647000+00:00,"I have a dockerized PHP/Laravel app that's working fine inside a php:7.4-apache container. We had it routed to  for development purposes.
Now we want this service to be available at  in our network of microservices.  Request to localhost go to an nginx service, and we've set up a rewrite rule in  to achieve this:
But now some  requests fail. This is what happens:
The problem seems to affect all URLs that contain a question mark. We stripped it for a request that contains no params, and the request went through. But that's not possible in the above case.
What is happening here? I'm not sure if the nginx rewrite rule might be to blame as I wouln't expect the browser to notice it's effect at all (and the above error message is from Chrome DevTools).
edit
Looking at the network tab in Chrome, I realized there are two similar requests:
One goes to  as expected. nginx responds with a 301 and a location header .
The second one goes to , which is precisely the location header from the first request. Again nginx responds, this time with a 404.
So it seems nginx 'forwards' the first request to itself instead of the Laravel app."
1.0,2020-11-10 19:10:13.863000+00:00,Trying to have a counter on a web page that does not restart on each different page view within the same user session. Currently using this code (thanks to Praveen Kumar Purushothaman) but this counter resets every time a different page is viewed.
0.0,2020-11-13 15:08:25.173000+00:00,"i have a problem.I am waiting for your help.Thank you
index codes are here.Even if i write dataType:JSON it didn't work.
index.php
ajax.php"
0.0,2020-11-09 08:31:00.823000+00:00,"I have a two tables:  and , where  Table stores the information about all the 's and  Table stores real-time data received from an inverter.
Now, I have 14 different sites from which I get the real-time date of the inverters, as shown below.
Output
I am using this same query to find the  of the  column by Grouping them with the TagName
But the result includes only the first TagName and not all the TagNames as shown below.
Output
If I hardcode all the TagNames in the subquery, then I am getting the results from all the sites. I don't want to hardcode them, is there any other way to include all the sites in the query results?
I am new to T-SQL, I think there maybe something else that I can use instead of the  clause, but I don't know which one. Any help would be much appreciated, thanks!"
0.0,2020-11-17 12:32:26.507000+00:00,"I am working on video DLL lib. There is the interface of COM frame class. Which is actually an image. While debugging, I want to see what happens to this frame. But only way to do it - to add  method to code and recompile. Is three some better debugging tactics or tools for debugging COM interfaces?
It is not hard to write some app with import possibility that will visualize frame if I only find the way to export it from MSVS during debug session."
0.0,2020-11-26 20:32:23.607000+00:00,"I'm trying to install Editor.js using node.js package in my hello-express Glitch project. This is the package via NPM:
I included the module in my javascript file as mentioned in the editor.js documentation:
But the following error appears in the browser console:
Uncaught SyntaxError: Cannot use import statement outside a module
I'm sure it's a bad installation in my Glitch project but I don't know how to fix it. Could you help me?"
0.0,2020-11-18 12:42:37.510000+00:00,"I have two fitted pipelineModels, and I want to save them as one pipelineModel.
Ideally, I want to do something like this:
but this doesn't work.
I have found similar question with the same problem in PySpark: Spark add new fitted stage to a exitsting PipelineModel without fitting again, but their solution (  ) does not work for me.
I tried to rewrite it in Scala like this  but I get the error &quot;no constructor accessible from here&quot;...
I am trying to avoid combining them as unfitted Pipelines and fitting them together"
1.0,2020-11-28 14:44:00.883000+00:00,"I am trying to build a neural network that takes in data in form of a matrix and outputs a vector but I don't know what layers to use to perform that.
My input has shape (10,4) and my desired output has shape (3,).
My current model is the following :
this at least results in a vector instead of a matrix but it has (10,) instead of (3,). I could probably find a way to reduce that to (3,) but I doubt I am doing the correct thing with this approach."
1.0,2020-11-25 09:23:23.107000+00:00,"Grouping an array by multiple properties, iam able to do grouping with single property but iam not getting correct output using 2 properties
I have an array like this
i want to group by (branch, school)
and the output should be
iam able to do grouping successfully using single property(branch) below code
grouping= above array
Any help will be greatly appreciated
thanks"
2.0,2020-11-20 19:02:55.953000+00:00,"I have an NMDS ordination that I've plotted using ggplot2. I've added environmental vectors on top (from the  function in ) using  and added corresponding labels to the same coordinates as the segments using  (code below):
However, since the labels are justified to centre, part of the label sometimes overlaps with the end of the arrow. I want to have the text START at the end of the arrow. In some other cases, if the arrow is pointing up, it pushes into the middle of the text. Essentially, I want to be able to see both the arrow head AND the text.
I have tried using  from the  package but the placement seems random (and will also repel from other points or text in the plot (or just not do anything at all).
[EDIT]
Below are the coordinates of the NMDS vectors (this is the  object from the example code above):"
0.0,2020-11-02 07:43:24.300000+00:00,"I need to know what is the Queuing model in WLAN toolbox examples, specifically Simulink model: 802.11ax System-Level Simulation with Physical Layer Abstraction in system-level simulation. Nothing is mentioned in documentation and I need to calculate the queuing model matching to this.
Would appriciate any help."
1.0,2020-11-11 09:29:23.887000+00:00,"On the click of a button in my app a popup opens. clicks on the button once, then it works fine, but whenever I click on that button continuously 2 3 times then I get the error given below.
I am getting this error.
This is my Code
How can I resolve this error?"
0.0,2020-11-17 03:23:20.293000+00:00,"The question is asking me to write a code for the trajectory path which I know how to do for one file but its asking for two different file paths box_wb.psf and md.dcd which i'm confused on how to do it for both?
The file path for box_wb.psf is ubiquitin_run/ubq_files/box_wb.psf
the file path for md.dcd is ubiquitin_run/ubq_files/md.dcd"
0.0,2020-11-06 17:00:00.663000+00:00,"I have a system with two database servers I am working with:
One of them is database first - a database managed by a legacy enterprise application and I don't have full control over changing the database structure.
The second is code first and I have full control in the code first database to make changes.
Security policies prevent me from making a view that joins tables from the two database servers in the code first DB which might be a way to make this better according to what i've seen on SO posts.
I have one context for each database since they are separate.
The data and structure in the code first tables is designed to be able to join to the non-code first database as if they were all in one database.
I CAN get what I need working using this set of queries:
Again, this works and gets my data back in a reasonable but clearly not optimal timeframe that I can work with in my UI that needs this by preloading the data before it is needed. Not the best, but works.
If I change the variable declarations to not be async which I was told I should do in another SO post, this turns into a cross db query and netcore says no:
Adding ToListAsync() is what allows the join functionality I need to work.
Q - Can anyone elaborate on possible downsides and problems with what I am doing?
Thank you for helping me understand!"
0.0,2020-11-20 08:46:24.540000+00:00,"I am trying to get the captions from a segment from a live feed. I am running the command
Output
`Input #0, mpegts, from 'seg-109853030-v1-a1.ts':
Duration: 00:00:06.01, start: 57867.901133, bitrate: 2649 kb/s
Program 1
My question  is what command should I run  to print out the caption file with the track metadata including label and language."
-1.0,2020-11-12 15:18:21.400000+00:00,"I need some help here with my game code. It's a game about making some dishes and delivering. You need to  catch some ingredients that are spawned in the ground, when you catch it they go to your inventory.
There are 3 types of recipes, with 1, 2 and 3 ingredients. Also, the ingredients DON'T need to be in order in your inventory to complete the recipe, it should just verify if you have the right itens. If you have 3 ingredients, it should verify in the list of recipes with 3 ingredients if is there anything with these itens.
The ingredients have names and Ids.
The recipes are a list of IIngredient, and the recipe has a name:
And the inventory
The player inventory:
When I deliver the item, I want to check how many itens do I have in my inventory, to know which recipes I should compare, and after, try to match my itens with all the recipes that have the same amount of ingredients. If any recipe match, I want to know who it was.
I'm using this code, but it's not working:
The last code block, that I try to verify and check if I have the itens, don't show any result. I don't even know if the code I wrote make sense hehe"
1.0,2020-12-01 10:20:05.480000+00:00,"my previous research on Google led me to this page:https://docs.oasis-open.org/mqtt/mqtt/v3.1.1/os/mqtt-v3.1.1-os.html
here I found some informations … and I startet trying. The testing setup is against a local mosquito. This works so far (it runs without errors), but if I send the PUBLISH message, I get disconnected from mosquito.
[edit] So the big Question is, what's wrong with the message.
You may wonder WHY THE HELL I'm trying to hardcode the implementation … it is to understand the functionality. I like to implement the Publishing in a robot system with a special language, which does allow the use of socket with connect / disconneect / send and receive commands to a given adress and port. Therefore I try to get it working in c# to adopt to the robot language.
Here you find the current code:"
0.0,2020-11-07 11:32:56.147000+00:00,"(This is my first post, sorry if it's not perfect)
I am in the process of making an API in nodejs with &quot;express&quot;, &quot;body-parser&quot; and Sequelize.
My HTTP API is working fine, however I am stuck on something.
Indeed, I have a &quot;message&quot; table linked to a &quot;user&quot; table
Association : message/user
Here is what I would like: Add a prefix to &quot;req.query&quot; when I call an include.
I have a &quot;getMessages&quot; route allowing me to get all the messages. I have included the &quot;user&quot; table
When I want to fulfill a condition (example: find all the messages where the user's language is EN)
I make the following request: http://localhost:8080/message?language=EN
This query works!
However I want to put &quot;usermessage.language=EN&quot; instead of &quot;language=EN&quot;, someone can help me please ?"
0.0,2020-11-26 15:39:43.190000+00:00,"I have a date string  which is passed to the backend ASP NET MVC application.
I am parsing the date/time string using the below code:
This code is giving me time which is 1 hour less than the actual time. This is because of Daylight Savings.
Now, I want to know if daylight saving is active in the timezone or not. So I wrote the below code:
The above code  condition is hitting multiple times with the following zones satisfying condition.
Yukon Standard Time
Pacific Standard Time (Mexico)
UTC-08
Pacific Standard Time
So, I further narrowed down the code
This time I got three:
Yukon Standard Time
Pacific Standard Time (Mexico)
Pacific Standard Time
Is it possible to get the exact timezone? (I know this user is in )
Or is it okay to use any (first one) and add one hour to time to get the correct time?"
0.0,2020-11-06 05:50:18.990000+00:00,"I am looking to grab the email address only from the records with the UserStatus = FORCE_CHANGE_PASSWORD.
I've got the following expression below to work but now I need to figure out how to fetch the 3rd Value key that contains the email address while omitting the first 2 Value keys."
-1.0,2020-11-12 19:10:48.533000+00:00,"I have a .txt file that i wanna sort that looks like this :
I want to sort every line where the second number in each line is the only important thing for the sort algorithm. I wanna sort them from the highest (e.g. 2,659,074) to the lowest(e.g. 35,744). The important part is that every line's content should not get edited or mixed up with other lines.
So the result should look like this:"
-1.0,2020-12-02 14:53:50.017000+00:00,"How can I start a loop on a different thread by pressing a ?
The main idea is, when  is clicked, start a loop on a , and when  is clicked, stops the loop in the .
The loop can be done by ,  loop or  loop, but he needs a way to stop by pressing a button."
0.0,2020-11-02 18:11:07.830000+00:00,"I have a class that has a member of type std::thread, however, when I want to use this class as a member of another class I always get the error that the constructor of the other class was implicitly deleted because std::thread constructor is deleted.
My class with the std::thread member looks as follows:
The other class looks like this:
I was thinking that I already am properly initializing the std::thread class with (here an empty) function. But I still do get this error, so it seems like somewhere there is still a copy constructor called?
I should also add the I can use the VideoSender class directly without errors. This only happens when used as a member of another class.
Edit
I then initialize RemoteCom like this:
This is really all there is. I reduced it all to this minimal example, the error still exists."
0.0,2020-11-02 15:04:57.477000+00:00,Would the flock() function prevent file corruption in this case whilst writing the file (in case two processes happen to try and write data to the file at the same time)?
1.0,2020-11-05 16:28:23.973000+00:00,"i'm working on the extraction of an algorithm from a source existing library. Inside a function there is a declaration of IplImage initialized with a Const cv::mat :
compiling i get the following error:
I think this is because the library uses an old version of opencv. So the question is how can i get the same result in the new version of opencv?(i'm using the latest)"
1.0,2020-11-26 14:40:00.627000+00:00,"This is the sample data,
I need this data to be read into dataframe without single quotes
But i am getting the data in single quotes when reading through pandas.
Can someone please help me"
0.0,2020-11-25 15:58:06.590000+00:00,I need to digitally sign email using s/mime. I've created a detached signature for my attachment but outlook can't open it: &quot;Cannot open this item. Your Digital ID name cannot be found by the underlying security system&quot;. Certificate is installed on this PC and there is smth need to be tweaked in this code:
0.0,2020-11-13 12:36:51.677000+00:00,"I have this array called  I want to insert into the database
Here is my Controller
I have a One to Many relationship with  and  Models"
0.0,2020-11-02 12:27:35.863000+00:00,"I have a C socket that listens on port 1001 on localhost. I also have the client code that connects to port 1001 on the ip 127.0.0.1. If I send the client's code to my friend, how could he have access to my machine when we would be on different networks? Is it possible for me just by changing the server code to make my public IP open for connections on port 1001? Below is the simple server code:
obs: I learning C."
0.0,2020-11-16 12:03:10.540000+00:00,"I have a websocket server running behind nginx.
Connecting via http works ok (ws://mywebsite.com) with following nginx config:
I'd like to connect to this via https (wss://mywebsite.com) and have tried this:
However, I get a  on the browser side (e.g. with ).
My understanding is that WSS is a connection to a standard websocket via https, is this correct?
Is my approach above correct?
Is there something obvious I'm doing wrong?
To confirm the cert was installed with certbot, and the e.g. https://example.com works.
Note also, there is another server block listening on 443, this does not define the /myWebSocket location (I think it is the nginx default ssl block that is superceded by certbot block).
Edit: note removing that first ssl server block results in the browser side websocket connection error message changing to .
Another Edit: I was connecting using the server's IP address not the DNS name - that removed the error. :-)"
0.0,2020-11-21 14:17:39.620000+00:00,"GitLab dedicated runner defined in the Yaml file using the Tags..But the pre build failing due to not able to pull the docker image defined &quot;amazonlinux:latest&quot;,,,,FYI below is where the runner is stuck.....
Running with gitlab-runner 13.5.0 (ece86343)
on runner1 xyzf
Preparing the &quot;docker+machine&quot; executor
If any experts out there, looking for your valueable suggestions. Thanks."
1.0,2020-11-03 00:33:58.650000+00:00,"I am using  under the hood for my SwiftUI application since  and  are extremely limited and/or buggy. I have a function called  that needs to take in a SwiftUI view, wrap it in  and then push it on top of the navigation stack:
Now, most of my calls look like , I have to cast every single view to  which is a bit annoying and unclean.
Is there a better way to do this so I don't have to cast every single time?"
-3.0,2020-11-17 16:54:56.843000+00:00,"Ok so the input will be a URL, let just say for example the URL is http://www.pcwebopedia.com/files/index.html
URL will always have let say the HTTP FTTP: // www. and etc
The project that Im doing is to break down URL into different parts and I'm stuck on one of the question
The question ask me to find the position Of Slash 1, as you see in the code rest of URL is
pcwebopedia.com/files/index.html the position is  15 for the first /
while http://www.pcwebopedia.com/files/index.html is 26, this is what I want.
There was a suggestion that said to first find how many characters there is from start of the string to period &quot;www.&quot; and add the value to positionOfSlash1"
1.0,2020-11-10 17:30:23.743000+00:00,"I have two different models,  and  where  has reference to .
I am trying to get all the teams that a user belongs and then get all the users that are members in those teams and merge them in one array without duplicates.  I have only managed to get the teams that a user belongs. Any ideas? (I'm a newbie)
My code:
my code result:"
