score,creation_date,body
1.0,2010-06-28 17:10:34.430000+00:00,Johnathan Snook has a article on the IE6 bug and its fix. I hope this solves the problem.
132.0,2012-08-27 13:02:42.347000+00:00,"You can do it this way:
Declare interface:
Let your Activity imlement it:
Then pass your activity to ListAdater:
And somewhere in adapter, when you need to call that Activity method:"
0.0,2014-01-11 20:53:39.280000+00:00,You can do something like this
3.0,2011-02-19 06:02:33.360000+00:00,"Nonblocking servers are the best choice provided all your libraries provides nonblocking apis. As mentioned in  your second question if a library blocks (eg database lib making a blocking call), the entire process/thread blocks and the system hangs. Not all of the libraries available are asynchronous which makes it difficult to use tornado/eventlet for all usecases. Also in a multi-core box multiple instances of nonblocking servers needs to be started to use the box capacity completly.
Tornado/Event servers are similar to java nio based servers. There is one conceptual difference between a Tornado and Eventlet. Tornado follows a reactor pattern where the single process waits for IO(socket) events and dispatches them to appropriate handlers. If handlers are nonblocking, best performance can be expected. Typically code written for these frameworks consists of a series of callbacks making it a bit less readable than a synchronous server .Java NIO servers comes under this category.
Eventlet performs the same task but with a cleaner interface. Code can be written as in the case of synchronous server without using callbacks. When an IO is encountered, eventlet schedules another userspace process(not right terminology). 
Apache webapps are more popular that these because of few reasons
It is relatively easy to write synchronous code
Not all required libraries are asynchronous.
But for writing a chat application which handles lots of connections a multi-threaded server will not scale. You have to use async frameworks like twisted/event/Java NIO."
2.0,2013-05-07 12:35:12.973000+00:00,You need to build the page first (thus populating your _deploy directory) via  and then push those contents to the gh-pages branch via .
4.0,2010-01-25 11:07:42.403000+00:00,"I'd recommend defining your own  implementation by subclassing .  That way you can ""back"" your model with any suitable collection (e.g. ).  When an ActionEvent is fired you would typically amend your underlying collection and then fire a  to cause the  to be repainted."
0.0,2009-02-05 06:27:22.043000+00:00,"I've fixed it now, it turns out that the spec command was running the old stock version that comes with OS X so it couldn't find the gem."
0.0,2009-09-30 16:27:46.737000+00:00,"You need to change the individual cells.  
This is VB code lifted from an app where I am able to successfully do this, but it shouldn't be to hard to convert this to c#."
9.0,2013-09-18 19:49:01.640000+00:00,"If you want to forgo MVC entirely, thereby avoiding all the HttpContext mess...
This uses the awesome open source Razor Engine here:
https://github.com/Antaris/RazorEngine"
2.0,2010-12-05 20:11:01.890000+00:00,"The  symbol is not a program argument, its a shell operator - it only works in a shell that understands it as part of parsing a command line.
Apparently, Eclipse doesn't use a shell to start up a Java programs and it doesn't itself process shell operators like  for starting up.  I'll bet if you printed the command arguments in your program, you'd see  and .  A shell would have processed them and not passed them to the program.
Unfortunately, I don't see anything in my version of Eclipse that suggests how to redirect the standard input to come from a file."
3.0,2012-08-17 19:02:04.040000+00:00,"The  command can take an  flag, which allows you to add data to existing files without overwriting old data. However for .mat files  only allows you to add new variables. If you specify a variable name that already exists in the .mat file it will be overwritten.
However, if you are saving to an ASCII file then data is simply appended to the end of the file.
This presents you with two options.
Save using a .mat file, but for each variable you want to save you would need to load any variables with the same name from the .mat file, combine old variable with the new variable and then resave it to the file.
Save the matrices using an ASCII format, and then convert the from ASCII when you load the file.
Update: After re-reading your original question, I have to ask why not save in a single operation rather than saving line by line? "
2.0,2013-09-19 00:46:43.250000+00:00,"This is your problem:
Line 25 of your source appears to be:
It appears that  is likely . I see that your  method attempts to set  to something, but you will want to make sure that's not returning ."
11.0,2011-03-04 09:14:01.317000+00:00,"I think that you shouldn't use removed iterator at all - in case of lists this causes serious problems, shouldn't be different for maps.
EDIT by Matthieu M: this code is well-formed in C++0x and allowed as an extension by MSVC."
3.0,2013-01-05 23:43:22.070000+00:00,"why did you open a  tag again, you are already in echo line?
and what is ? Is that a variable, did you forget to put ?
echo prints out the string that you gave as parameter,
As @hakre mentioned about it,  is used to concatenate strings.
So you can use it in echo line,
And It's not important weather variable defined as a string. It would be a constant variable."
0.0,2014-06-19 17:30:28.440000+00:00,"Or...(du-uh, don't know why I didn't think of it sooner) just use the cell/column/row tags:
Now you can add your properties to your ""My"" classes:"
0.0,2011-06-28 19:48:21.737000+00:00,"On my servers I don't define a primary site in my main httpd.conf file. I do all the virtual hosting in separate application specific conf files.
The only thing I have in my main httpd.conf is the line 
Here's a gist of a way you could try it. I pulled all the wedding site configuration out of your main site configuration. I set it so davidstites.com, afewguyscoding.com, and www.davidstites.com all redirect to www.afewguyscoding.com. The other domains (milehigh et al) are unaffected. I'm not sure where you wanted those to go.
All the wedding related domains redirect to www.davidheartsrachel.com.
I did notice what I think might have been a mess up in your main site configuration. Toward the end where you set your directory permissions you were using the /var/www/afewguyscoding/current/public directory instead of the /var/www/wpress that is the DocumentRoot. The correction I made there is on line 74 of the first document in that gist."
0.0,2012-09-23 12:10:20.103000+00:00,"XMLHttpRequest is the best way, as far as I know, but there are other techniques too. There is the old school way some sites still use. Using hidden iframes and sending request through it.You create an iframe with javascript, append it with 0 width and height and the request the php file. The output must be script that somehow communicates with the parent window script."
0.0,2010-07-18 01:04:53.043000+00:00,"Read Generic BinaryReader and BinaryWriter Extensions, a great way to handle generic casting the unmanaged way.
For VB.NET (safe code only, can also be achieved in C#) use the following:
Imports System.IO
Imports System.Runtime.CompilerServices
Imports System.Runtime.InteropServices
You can now implement the same functionality for , for  etc."
143.0,2013-10-08 13:59:04.647000+00:00,"I found an answer on another thread, but I'll answer the question in case someone else wonders. 
Just replace the  in  with this:"
0.0,2010-12-08 14:41:35.687000+00:00,"EclipseLink JAXB (MOXy) (I'm the tech lead) has an XML mapping file.  For your example the mapping file would be:
binding.xml
Domain Model
This would map the following classes:
XML
To/from the following XML:
Demo Code
As demonstrated by:
jaxb.properties
To use MOXy as your JAXB implementation you need to include a jaxb.properties file with your model classes with the following entry:
Note
This example uses the simplified bootstrapping available in the upcoming EclipseLink 2.2 release.  For an example using EclipseLink 2.1 see:
http://wiki.eclipse.org/EclipseLink/Examples/MOXy/EclipseLink-OXM.XML"
0.0,2012-01-20 03:42:22.350000+00:00,"Instead of calling the VLC binary directly in your console command, try calling  against that command (i.e., ).
Note that this call will return more or less immediately (so if your application is depending upon the call returning in order to determine when VLC has been terminated, it will have to yield some other way)."
0.0,2010-12-10 09:27:57.183000+00:00,"I've heard of OCI API that does it, but not sure if its available for C# (ASP as u mentioned). The only option is to kill that process. "
0.0,2010-06-24 23:14:55.763000+00:00,"Rather than fudging around and trying to find a way to pass contextual information while using the insertion operator, I suggest you make something like a print method like choobablue suggests. It's a nice and simple solution and anything fancier is probably more trouble than it's worth.
I also find it odd that you choose iostreams for an embedded system. They're one of the most bloated parts of the C++ standard library (not just by implementation, but by design) and if you are working on an embedded system, you could just as well roll your own alternative of this (still based on the basic design of iostreams) and can probably do it just as quickly as trying to use iostream effectively and across multiple threads."
0.0,2013-09-07 04:21:48.790000+00:00,"you can achieve this with the use of xib read carefully and if you don't understand anything you can ask me again it's bit tricky
in you xib create a UIView and design for your photo and firstname, lastname cells with the use of textfields image views and all and then take a UITableView.
now drag your UIView and drop it on your UITableView so that it will be considered as your table header and your first section now will be as you designed like photo with firstname and lastname fields.
i've done this in manier projects of mine so hope this way you can also do this thing and ask me if you need any help."
4.0,2013-06-02 17:03:53.810000+00:00,"Because in the first producer, you synchronize on , which is the , not the producer itself.
So you would need to use  instead, except that it won't compile because  is not available yet on that line.
Alternatively you could name your Runnable:
and in your consumer:
But your second approach with a separate mutex is preferable, except that locking on  is an extremely bad idea as this is a global constant (the empty string is in the string pool). You should prefer something like this instead:"
44.0,2011-10-11 13:14:47.073000+00:00,
1.0,2012-12-21 15:10:56.953000+00:00,Try this:
4.0,2011-06-25 16:03:01.403000+00:00,"Reduce variable sizes (in embedded systems)
If your variable size is larger than the word size on a specific architecture, it can have a significant effect on both code size and speed. For example, if you have a 16 bit system, and use a  variable very often, and later realize that it can never get outside the range (−32.768 ... 32.767) consider reducing it to 
From my personal experience, if a program is ready or almost ready, but we realize it takes up about 110% or 120% of the target hardware's program memory, a quick normalization of variables usually solves the problem more often than not. 
By this time, optimizing the algorithms or parts of the code itself can become frustratingly futile: 
reorganize the whole structure and the program no longer works as intended, or at least you introduce a lot of bugs.
do some clever tricks: usually you spend a lot of time optimizing something, and discover no or very small decrease in code size, as the compiler would have optimized it anyway.
Many people make the mistake of having variables which exactly store the numerical value of a unit they use the variable for: for example, their variable  stores the exact number of milliseconds, even if only time steps of say 50 ms are relevant. Maybe if your variable represented 50 ms for each increment of one, you would be able to fit into a variable smaller or equal to the word size. On an 8 bit system, for example, even a simple addition of two 32-bit variables generates a fair amount of code, especially if you are low on registers, while 8 bit additions are both small and fast."
2.0,2012-03-01 17:31:17.083000+00:00,"You are reinventing the wheel.  valuelist(getparts.binnum) will give you your list without all that looping and checking.  Or at the very least you could use ""listAppend()"" to avoid all that comma checking :)"
2.0,2009-10-14 05:41:47.280000+00:00,"Just make a selector that matches any of the id:s when doing the initialization:
Now you have the dialog set up for all the elements, and you can call dialog('open') on any of them."
4.0,2010-12-23 05:50:39.603000+00:00,"The current state-of-the-art floodfill algorithm (since 2006 or so) is based on finding the contour (the outermost boundary) of the connected component, converting the contour into horizontal pixel runs (and detecting and removing of internal holes from the connected component), then fill the pixel runs. The benefits are vastly reduced memory requirements (and/or stack level) as well as being faster (interior pixels are guaranteed to be read exactly once and written once). However the algorithm is not trivial. You'll need to read some research papers in order to implement it."
0.0,2014-03-07 08:16:33.023000+00:00,"I think you're missing the Access-Control-Allow-Origin header, as the message said :)
Here is the same question on SO.
Edit: To address your header alternative question
As far as I understood you're searching for an alternative approach for header redirects. Well typically PHP Frameworks I know use some Bootstrapping mechanisms to build the user output. Take a look at my rude graphic below:
Essentially the request from the client will always be handled via a main entry point (index.php) where you depending on the url style either use hashes, or parts of the querystring to determine where to navigate to. Thats the job of the bootstrapper to find out: ""Ok the user want's to visit Page XYZ"".
The next layer could be the Authorization amongst others. Here you would check whether the user has the permission or not if so continue to your BL and render the result which then is returned to the client.
So this whole sequence takes place during the initial request from the client thus no redirecting would be needed. For detailed examples take a look how well-known Frameworks do the Job."
1.0,2011-03-23 11:53:09.327000+00:00,maybe he meant how to traverse such tables? running DFS on mySql can be tricky
1.0,2013-11-21 22:21:07.020000+00:00,Thank you Astral. You're answer is perfect. I really didn't want to have to use map reduce just to do a simple timezone adjustment.
1.0,2014-06-12 07:37:04.510000+00:00,@m_gol happened to be reading down the comments as my `zsh` did this +1 for your help!
0.0,2014-01-29 17:21:29.927000+00:00,"Thanks, I will take a look at that and get back to you about if it does what I need."
0.0,2017-01-03 09:18:27.360000+00:00,"This answer is amazing. how to do FooBar::fizz()->select(""something"")->where(""something"");"
0.0,2013-08-16 11:03:26.670000+00:00,im using horizontal listview so cant declair width height wrap content
0.0,2013-11-17 20:36:43.823000+00:00,"Sorry to bump this post but I came across this, implemented it and unfortunately what happens is that when csrf is enabled, it shows the csrf error every time a form is submitted! Any ideas what might be happening?"
0.0,2011-06-27 18:40:54.560000+00:00,"D'oh! I put the populate listbox routine in the PostBack 'IF' statement, and totally forgot about the 'ListBox.Items.Clear' statement just two lines above!!! Thanks for your help kprobst!"
0.0,2010-05-16 21:31:41.333000+00:00,"If head closes the stream, then why does `$stdout.closed?` still return false and why does the error not happen immediately, but only after many lines have been written into the void? I think head actually keeps the stream open, but doesn't read from it anymore, which causes the buffer to be full at some point which causes the broken point."
0.0,2013-03-14 10:58:36.853000+00:00,"MayoMan ,
ImageAndLabel is in flextable ,
 wherever you add your ImageAndLabel it is added inside flextable so you have to apply css to the widget where you are going to add your ImageAndLabel
ex: horizontalPanel.add(new ImageandLabel) than apply css to horizomtalPanel"
0.0,2008-10-10 15:18:54.557000+00:00,"Okay, that works but I'd like to know a bit more about why before I give the ""answered"" stamp. I'm resonably new to data binding, so I'm not familiar with some of the more advanced synatx. What exactly is local-name() doing here?"
0.0,2012-02-22 04:41:26.990000+00:00,yes for jquery very widely used and well documented made by one of the guys that works at jquery
0.0,2011-12-20 20:43:16.423000+00:00,Thanks.. thats exactly what I was looking for.. earlier didn't thought of LOCK_NB. Thanks again.
0.0,2010-02-10 10:26:55.897000+00:00,I have spent half an hour to edit my question just like u did - how did u do it/
0.0,2013-01-23 15:34:54.930000+00:00,"I am able to reproduce the concurrent performance issue using the async methods on `HttpWebRequest` in a tiny test project, and here `MONO_DISABLE=1` does not seem to help either. This seems to suggest, that I actually do hit an async method call in AWSSDK, but I have still not been able to locate such call."
0.0,2014-10-01 11:23:53.143000+00:00,"@MikeM. But again, it only trigger the alarm after the minute I've set it regardless on how long I set it to repeat and stopped the recurring. Do you have any idea?"
0.0,2013-10-14 18:04:44.713000+00:00,"@user2879618 It is the socket descriptor you passed to bind, listen or simply the socket descriptor returned by socket()"
0.0,2012-12-19 20:14:05.660000+00:00,You are absolutely right.  Thanks so much for the quick response!
0.0,2010-01-08 17:48:03.827000+00:00,"Hmm that is news to me.  Contradicts things I've seen in the past, I will have to experiment to be sure I follow what you're saying.  Thanks for the clarification though."
0.0,2012-03-15 14:31:40.287000+00:00,"Telmo Marques answer contains an example of what I was talking about. He is using onKeyUp instead of onKeyPress, which has some advantages, but also some disadvantages as well (as in if you press the letter and don't let go of the button, it's not going to register until you let go)."
0.0,2014-06-13 11:02:36.013000+00:00,While we're at it - could you please suggest any good materials about apply functions? I have always seen them having a great potential but never quite got hang of them.
0.0,2014-09-10 01:25:27.843000+00:00,"Sorry i think im not be clear enough. i want to something like a fallback. based on your example something like this: $query->bind_param(""id"", $id, 'id');"
0.0,2013-09-02 15:32:42.633000+00:00,I have no idea. The code you posted doesn't have anything to do with hub.js.
0.0,2013-05-10 05:58:31.560000+00:00,Ya i know but thats what the project requirement is :/
0.0,2009-10-06 16:16:12.310000+00:00,"Wow... read() actually returns the whole size, but in gdb i only get this:
$2 = (uint8_t *) 0xb65f2008 ""FLV\001\005"""
0.0,2010-07-12 13:41:39.677000+00:00,"Good stuff, if it works, then I like it. Let me test it. By the way: dumb question: is it or is it not Unicode?"
0.0,2012-03-02 10:31:45.177000+00:00,"So, calling `.flatten` on the array will make it [postA1, postA2, postB1, postB2]. Then you can loop over each post and call its methods on it. Cheers!"
0.0,2017-07-08 11:57:51.140000+00:00,doesn't your answer eventually suggest to never have `content-available:1`. Basically you just said to never use silent notifications...
0.0,2012-10-21 20:11:22.920000+00:00,You mean the select operation does not return any results in delphi application? Did you try the query directly on db? Any other operations in this delphi xe2 app produce results? Is this the only part of application that doesn't succeed?
1.0,2012-05-02 15:32:49.133000+00:00,"Thank you!! I was using an old version (1.4.2). I replaced it by (1.7.2). I got no errors anymore but i have still a coding fault. The application must check if a username is available(at runtime) but the output is always not available, but i will look for my fault. THanks!"
0.0,2011-07-08 15:16:21.753000+00:00,Yes yes... It's just a dummy one!
0.0,2017-07-20 13:22:04.763000+00:00,"I see how this would result in the CAPTCHA content, but why is the cURL handle resource no longer valid after requesting this page? Is this documented behaviour?"
0.0,2014-01-06 16:29:22.583000+00:00,Moreover doing this fails all calls to update_attributes method with the exception can't modify frozen hash.
0.0,2014-06-29 19:57:53.930000+00:00,"You could override the constructor as well so it doesn't do the database stuff.  But if things get too messy, you should indeed use a mock and probably live with the when-then stuff."
0.0,2012-11-06 15:58:10.203000+00:00,@Jack - could you give a more complete example?  I can't see why that wouldn't work.
0.0,2009-05-10 19:14:01.353000+00:00,Re `DataRowCollection` - it doesn't make any difference. My test sample is using an attached row from a DataTable.Rows (a DataRowCollection) - and it simply doesn't work. Sorry.
3.0,2011-03-16 18:45:54.080000+00:00,"I like it. Though I would suggest a different name for your macro. Perhaps ""defcurry"" or maybe ""defcurried""."
0.0,2011-10-01 00:16:11.860000+00:00,"@chibacity: I don't need events, a simple wait is fine. I don't need to yield because 1) it's never more than half a second (total) and 2) the application doesn't need to be responsive when this happens anyway."
0.0,2015-06-15 19:28:09.837000+00:00,You can accept your own answer by clicking on the green tick. This removed the question from the StackOverflow queue of unresolved problems.
0.0,2014-05-06 18:53:54.127000+00:00,Yes offcourse. Replace the 'wait on notifier' with an event case in a while loop. In the time-out case of the while loop you check whether the DLL has finished. In another case you wait for the boolean event change.
0.0,2014-07-18 00:19:17.987000+00:00,"Those PDF's are the specs for OpenGL ES 2.0 and OpenGL Shading Language, it might be easier to find tutorials and only use the spec pdf's as reference when you get hung up on something."
0.0,2014-07-22 20:10:22.833000+00:00,@Maven: see section `SYNCHRONOUS VS. ASYNCHRONOUS` in http://square.github.io/retrofit/
0.0,2010-02-23 16:13:31.940000+00:00,"Thank you very much ashtonium. I had another solution going after attempting it myself, but this is a little more elegant."
1.0,2011-11-12 12:04:39.023000+00:00,"An application which is not installed shouldn't need to be uninstalled. It should be removable by simple deleting the executable; or, at most, if it creates some files in its own, empty directory, by removing this directory. *Or*, the application itself could provide its own ""uninstallation""."
1.0,2011-10-24 01:01:25.297000+00:00,You would open up KeyChain find your cert right click on it select export and make sure you changed the file type to `Personal Information Exchange (.p12)`
0.0,2010-10-19 02:38:05.487000+00:00,"@some: `""""+location` is a nice idea. You should still be able to use `[4]` instead of `charAt`."
0.0,2019-11-29 13:01:35.170000+00:00,"Thanks, a variant of this worked for me. Just one thing though, the line `$(""div.uzidoboz"").scrollTop(div);` didn't work for me until I changed 'div.' to '#': so `$(""#uzidoboz"").scrollTop(div);` worked for me."
6.0,2015-09-15 23:05:10.120000+00:00,How do you pass the interface to the adapter though (from the Activity)
0.0,2014-01-11 21:06:43.413000+00:00,It was a mistake. Thanks
0.0,2011-02-20 05:28:34.080000+00:00,"You can use multiprocessing and run multiple instance. But if for some reason you need to share state, then shared memory, queue/named pipes etc will have to be introduced."
0.0,2010-01-25 16:05:58.517000+00:00,Can you please give me a brief example?
0.0,2010-08-24 15:26:12.977000+00:00,"-1 for posting a question, telling us you fixed it, and not telling us how you fixed it"
0.0,2009-09-30 18:04:29.303000+00:00,@David Stratton: I've just tested it and it does work (see my answer). For what reason it didn't work in your case? Why would setting the ForeColor for the individual cells work better??
0.0,2017-09-12 17:31:51.223000+00:00,"@Layinka Not sure if this helps, but most of the error info is in the `CompilerErrors` property of the exception."
0.0,2012-08-18 09:30:38.250000+00:00,"Because i am creating a recognization aplication and i need to store data from learning to a table. Then using KNN i need to look into that table to find the closest one. Ill try with -append flag.The data stored is: Name of the object, RGB colors and roundness of and object. Thanks for the help."
0.0,2013-09-19 01:01:47.563000+00:00,I have putted an if statement that check if it's null or not. and it is null
2.0,2011-03-04 09:16:04.040000+00:00,"Standard c++ map::erase does *not* return a new iterator, that's a MSVC extension."
0.0,2013-01-05 23:48:34.397000+00:00,"Could you explain to me for future reference what the dots do in PHP if you don't mind? The SITE_URL is a string of the website address gained from a config.php file in a CMS. It is setup during the CMS installation.
i.e. define('SITE_URL', 'http://localhost:8080/phpvms');"
