score,creation_date,body
9.0,2010-04-18 23:45:24.540000+00:00,"Yes, Sun can (Oracle now, I guess):
fdlibm, the ""freely distributable math library"", has sqrt and pow, along with many other math functions. 
They're fairly high-tech implementations, though, and of course nothing is ever the ""most efficient"" implementation of something like this. Are you after source code to get it done, or are you really not so much looking for  and , but actually looking for an education in floating-point algorithms programming?"
2.0,2014-08-27 13:51:10.267000+00:00,"Assuming you get a valid JSON array, a custom converter with JSON.NET would work as well:
Usage:
Example: https://dotnetfiddle.net/TEbNsH"
2.0,2013-02-25 14:20:27.623000+00:00,"Figured it out.  Here is simplified version.
If you change {rendererFactory} (updating existing or creating new), it will not trigger refresh.  After making changes to the factory, i did myDatagrid.rendererProviders=myDatagrid.rendererProviders and that triggered the update and recycled the renderers."
0.0,2014-07-31 19:39:54.170000+00:00,"The best solution probably depends on what exactly you mean by ""a merge operation"". 
If what you mean is that you want to insert entities from the set (table, csv-file or whatever)  which aren't already present in set , you could 
define suitable  and  methods for your entities
read all existing records in  into memory in one go (assuming they fit in memory), putting them in a 
read all entities from , calculate , which should be very fast, and then insert  into , possibly using the bulk insert library.
The key here is to avoid having to do database lookups for each element in ."
0.0,2013-10-15 13:15:47.867000+00:00,Turns out all I needed to make it work were these two lines of code:
3.0,2012-05-08 12:31:44.190000+00:00,"You cannot change the initial key name of an Amazon EC2 instance as shown in the AWS Management Console.
However, as you've already explored, it is not a problem to add another key for every day usage and won't be a problem in the long run either; in fact, you could also delete the former key pair via the AWS Management Console with zero impact on your already created instances, please see Eric Hammond's answer to consequences of deleted key pair on ec2 instance for more details on the subject matter."
1.0,2012-07-11 19:00:43.057000+00:00,
6.0,2013-06-11 10:46:54.087000+00:00,"Most likely the project was imported into IDEA, but it's not a pure Java project.
Note that non-Java projects cannot be imported from the existing sources using the Import option.
You should create a new project, select the appropriate module type and then point to the existing directory with the code when creating the module.
Other options are to import from Maven/Eclipse/Gradle.
There is a known issue logged.
If it's not the case, please share a sample project (zipped) that will reproduce the problem."
0.0,2013-06-06 08:19:40.273000+00:00,"Share the code you are using plz. The description is very brief. BTW, you can have a look at this link how to save state with onSaveInstanceState and onRestoreInstanceState while orientation change"
2.0,2011-06-11 13:27:29.233000+00:00,"Check out the jQuery hotkeys plugin
http://plugins.jquery.com/project/hotkeys"
3.0,2010-09-28 11:26:20.690000+00:00,"I'm using MvcExtensions. One of the features is a nice way to describe metadata like this:
Neat thing is - this allows to use resources for localization in strongly typed fashion.
Drawback for using this - there's bunch of other things bundled which You might not want to use."
36.0,2013-10-24 03:24:07.620000+00:00,"As José Valim said, you can call  inside iex."
4.0,2010-06-30 10:56:27.370000+00:00,You can change culture for thread:
1.0,2013-11-24 00:46:31.243000+00:00,"I think the best way to explain why this problem occurs is to go through what is happening step-by-step:
The main window is built.
The user clicks either the  button or the  button.
The  function, which each button is hooked up to, is invoked.
The function runs through to this line: .
Since the user hasn't entered anything yet,  returns an empty string.  Empty strings cannot be made into floats, so a  is thrown.
So, summed up, the problem is that you are not adding any safeties for if  returns a string that cannot be converted into a float (i.e. an empty string, a string with letters in it, etc.).
You can create a safety like this:
or, like this:
Regardless of how you choose to solve this problem, you need to do something for when the return value of  cannot be converted into a float."
1.0,2010-12-07 21:18:44.187000+00:00,"I suspect that the PDFs in question are ""web enabled"", AKA ""linearized""... possibly including the ones with the ""page 2 bug"".
Basically, a linearized PDF has a bunch of ""hints"" at the beginning of the file giving byte offsets to various relevant bits, particularly the byte range needed to display the first page (which is required to be at the front of the PDF).
Requests to read these byte ranges may be broken up into any number of HTTP requests (including ""one"").  It's not particularly odd that iframe &amp; object tags behave differently.  In one case, the PDF gets an entire window to itself, in the other it must share with HTML content: however thinly wrapped, it is wrapped.
Alternatively, one of the requests could be for the beginning of the PDF rather than the entire thing, again related to linearized PDFs (attempting to determine if the PDF is linearized, then reading the whole thing).
In either of the above cases, this is normal behavior.  OTOH, if it's requesting the entire PDF twice, that's A Bad Thing... quite possibly a bug in the PDF plugin."
11.0,2010-09-02 18:56:59.687000+00:00,"Sure, but you might want to rewrite it as
which does the exact same thing."
2.0,2013-03-28 14:10:35.603000+00:00,"Since you are making several calls to a database file (that isn't going to change), I'd start out by defining your connection string and your SQL statements at the top of your class as global values:
These never change, so there is no reason to define them again each time you call your routine.
Personally, I do not like inserting values into SQL statements, like you have shown. Rather, try to use Parameters.
To use Parameters, you'll need to look into your database to see what type of columns  and  are. My guess is that they are both int values, but these could be GUID like values, requiring  type strings. If these are strings, you should write down what sizes the columns are defined as.
For example: Below, my  column is the  and the size is 50. An  for this column would be:
Since I did not know what type of data you use, I created an enumerated type to show how each method would be used. If you do not have access to the table's design, the last resort is ""AddWithValue"" (I personally hate that one, because it makes me look like I don't know what my database has inside).
To use this enumerated type, I modified the signature of your method to pass in that value:
Obviously, you will not need this, because you should know what technique you are going to be coding with.
I wasn't able to figure out what your  object was. Initially, I thought this was your , but that does not have an  method, so I just commented it out:
Speaking of ...
I combined your  instance with your  instance. Less code typically means fewer errors:
The , by default, is , so this line is unnecessary:
I moved most of your variable reading outside of the  routine, as none of that should ever cause an exception to be generated.
Also, I used the more targeted  instead of the general . The only thing that could fail in the block is something  related, and the  will give you better/more specific error messages than the general  object will.
So, what does it look like all put together?
Code:
Happy Coding!"
0.0,2012-09-30 16:23:28.343000+00:00,you can use it like this 
2.0,2011-10-12 16:17:25.353000+00:00,"Why are they might be different:
http://www.parashift.com/c++-faq-lite/newbie.html#faq-29.16  
  Floating point is an approximation...  
http://www.parashift.com/c++-faq-lite/newbie.html#faq-29.17  
  The reason floating point will surprise you is that float and double
  values are normally represented using a finite precision binary
  format. In other words, floating point numbers are not real numbers.
  For example, in your machine's floating point format it might be
  impossible to exactly represent the number 0.1. By way of analogy,
  it's impossible to exactly represent the number one third in decimal
  format (unless you use an infinite number of digits)....
  The message is that some floating point numbers cannot always be
  represented exactly, so comparisons don't always do what you'd like
  them to do. In other words, if the computer actually multiplies 10.0
  by 1.0/10.0, it might not exactly get 1.0 back.
How to compare floating point:
http://c-faq.com/fp/strangefp.html  
  ...some machines have more precision available in floating-point
  computation registers than in double values stored in memory, which
  can lead to floating-point inequalities when it would seem that two
  values just have to be equal.
http://www.parashift.com/c++-faq-lite/newbie.html#faq-29.17
Here's the wrong way to do it:
If what you really want is to make sure they're ""very close"" to each other (e.g., if variable a contains the value 1.0 / 10.0 and you want to see if (10*a == 1)), you'll probably want to do something fancier than the above:
There are many ways to define the isEqual() function, including:
Note: the above solution is not completely symmetric, meaning it is possible for isEqual(x,y) != isEqual(y,x). From a practical standpoint, does not usually occur when the magnitudes of x and y are significantly larger than epsilon, but your mileage may vary."
0.0,2011-03-01 14:17:27.270000+00:00,"You could explode with 
and strip_tags() to get the rows (ignoring the first one), and loop through them and explode with 
to get the cols."
0.0,2012-04-01 11:17:49.907000+00:00,"Your code:
Prepared statements (in-and-of-themselves) don't protect against SQL injections. You need to bind the parameters. Check out: http://php.net/manual/en/pdostatement.bindparam.php.
In your example above, SQL injection is entirely possible. I can't see where you define  or , so I can't tell for sure whether or not it's safe."
1.0,2014-01-14 07:37:31.193000+00:00,Place this rule in your  file:
7.0,2010-12-14 03:26:38.590000+00:00,"Your  is a special case of .
You can usually find this sort of thing through Hoogle, but it seems to be a little broken at the moment.  The command-line version I have installed on my system gives  as the first result for the query .
And sure, you can define that operator, it's just  (or )."
0.0,2014-09-30 09:16:36.373000+00:00,"Ok , but you specified very minimum information to solve this kind of problem , since i have not understood it fully , i have the following suggestion.
How about using before and after interceptor on grails.
let me know anything if u need more help . . . "
2.0,2011-08-06 09:28:38.357000+00:00,"As the syntax of a roll is fairly complex, why not write a parser instead of using a huge regular expression?"
0.0,2011-12-08 03:44:21.643000+00:00,"If you are launching PreCamera activity from TcpClient activity:
Try this"
2.0,2010-08-06 12:30:22.323000+00:00,You can delegate the sorting to your own sort function:
1.0,2010-11-19 20:04:23.200000+00:00,"If you run ProcessExplorer on your server you will notice that an out of band process called nunit-agent is spawned which ends up blocking the nunit runner. 
I have not validated that this is fixed in 2.5.9, but it might be some info that could be helpful."
4.0,2013-08-18 04:58:38.890000+00:00,You can follow the step-by-step tutorial / wizard at http://www.buildmypinnedsite.com
34.0,2010-08-25 10:02:07.370000+00:00,"MichaC's and Anderson's version placed the underline slightly wrong, here is an updated version that will just add an underline to any  that are inside the ."
8.0,2011-11-03 10:32:56.673000+00:00,"Short answer: no.
Long answer:
There is limited introspection available at compilation time, and you can for example (using function overload resolution) detects if a class B is an accessible base class of another class D.
However that's about it.
The Standard does not require full introspection, and notably:
you cannot list the (direct) base classes of a class
you cannot know whether a class has only one or several base classes
you cannot even know if a base class is the first base or not
And of course, there is the issue that the object layout is more or less unspecified, anyway (though C++11 adds the ability to distinguish between trivial layout and class with virtual methods if I remember correctly, which helps a bit here!)
Using Clang, and its AST inspection capabilities, I think you could write a dedicated checker, but this seems quite complicated, and is of course totally non-portable.
Therefore, despite your bold claim P.S. Please don't reply with ""why do you want to do this"" or ""this is against the standard"". I know what what all this for, and I have my reasons to do this., you will have to adapt your ways.
Of course, if we were given a broader picture of your usage of this class, we might be able to pool our brains together and help you figure a better solution.
How to implement a similar system ?
I would propose, first, a simple solution:
 is the owner class, non-copyable, non-convertible
 implements a proxy over an existing  (as long as  is convertible to ) and provide the conversions facilities.
We will use the fact that all pointers to be manipulated inherit from  (this is a crucial information!)
Code:
Now that we laid down the foundations, we can make our adaptive proxy. Because we will only manipulate everything through , we ensure the type-safety (and the meaningful-ness of our ) by checking conversions through  and  in the template constructors:
It might be tweaked according to your needs, for example you could remove the ability to Copy and Move the  class to avoid situation where it point to a no longer valid .
On the other hand, you could also enrich this using a / approach in order to be able to copy and move the wrapper and still guarantee the availability (but beware of memory leaks).
Note: it is intentional that  does not provide an  method, such a method cannot be used with a base class. Otherwise with both  and  deriving from , you could attach a  through a  even though the original  was a ...
Note: this is easy because of the common  base class! This is what gives us a common denominator ()."
3.0,2014-06-29 11:59:02.513000+00:00,"Unfortunately, the REST API is still a long ways behind the Classic API with features it provides.  These features you mentioned are things I've seen come up quite a bit, and to my knowledge they are not yet available with the REST services.  
I personally have stuck with Classic as they provide everything and I really see no advantage to using REST myself.  If you happen to be working with PHP (which I always do) you may be interested in my class library for PayPal.  It makes all of the Classic API calls very quick and easy for you, and it's available on Packagist so you can use with Composer easily.  "
4.0,2012-06-07 13:58:00.433000+00:00,"You can change the ""Delete on Termination"" setting for your instance to keep an EBS volume even if your instance gets terminated. If you are using the command line tool, you can use the ec2-modify-instance-attribute --block-device-mapping command. Here is a link to Amazon's documentation on this subject. http://docs.amazonwebservices.com/AWSEC2/latest/CommandLineReference/ApiReference-cmd-ModifyInstanceAttribute.html?r=4426"
5.0,2013-03-21 10:44:28.360000+00:00,"Just use  instead of . And for passing them to a PHP script you have multiple ways. first you can create a query to send them with JQuery, like:
Second you can create hidden input elements, and post them with a form."
0.0,2012-01-13 05:57:25.423000+00:00,"First of all, Git is not lying to you. The file really is tracked in the branch, and really does exist in the work tree, and really is untracked.
Given that you suggest in comments elsewhere that the file doesn't show up in diffs or even , it sounds like you've added it to your gitignore (maybe unintentionally via a wildcard pattern). I know you said you didn't, but if it doesn't show up in the output of  as an untracked file, then it's untracked and ignored. To verify this, you can list all files ignored by .gitignore:
You can also list all untracked files, ignored or not:
(You seem to say that you're very sure the file is tracked - if it really were,  would show the committed contents of the file. I suspect, however, that that will instead tell ""fatal: Path 'path/to/file' does not exist in 'HEAD'"".)
Another way to verify that the file is untracked and ignored is simply to rename it, then see if  reports it as deleted; if it doesn't, it wasn't tracked.
Assuming this does list the file in question, you should examine the file in your work tree. You can see what version of the file the other branch has using , to compare. If you're satisfied that you don't need the version in your work tree, simply remove it. If you're worried you might need it, rename it or move it out of the directory. If you realize you do need it, you should figure out what ignore pattern is ignoring it, remove that, add it, and commit it. In any case, once you've dealt with the file, you'll be able to switch branches."
1.0,2013-02-08 02:44:28.507000+00:00,"here's a simple version.
for better performance, add an  on columns 
UPDATE 1
and"
3.0,2014-07-03 07:41:27.947000+00:00,"For 180s... you must ""create"" an iOS Background Task.
Please, modify your code whit this:
From here:  http://hayageek.com/ios-background-task/"
10.0,2010-05-20 05:15:46.923000+00:00,"Code a little game like tic-tac-toe or pong.  Lots of fun and a sense of accomplishment when you are done, but complex enough to keep you working at it for a while :)
There are also code competition sites like topcode at google and such to keep practiced.  Heck, code kata could help as well.  Like playing an instrument, you must keep practicing to get better.  Ideally, you'd get an entry level / internship position to further improve your abilities under a mentorship.
If you lack a compiler, microsoft has a free version of the latest dev studio available for download.  It can do c, c++, c# and anything in between.  Also, the suggestion of gcc is a good one as it is widely used in various open source developments over at source forge - another place to go and sign up for a project and help out a group project."
0.0,2014-08-29 11:55:18.133000+00:00,"You could use correlated subqueries for this:
Alternatively, group by the date, and count how many rows in the group have the desired status:"
0.0,2011-06-22 16:13:18.923000+00:00,"This'll turn your server into a wide open door for anyone to grab any file they want, but... it does what you want.
Enjoy..."
7.0,2013-06-05 06:22:35.187000+00:00,"There are definitely four options here:
Abandon  and just have a //:
Put just a / block inside the  block:
The same as the second option, but with the / outside the  block instead of inside. I don't think it makes much difference which you use, to be honest.
Catch the exception at a higher level anyway, e.g. in the calling method. Often this is a better approach, as you may well want to handle one type of exception from multiple ""small"" operations in the same way from the perspective of the ""larger"" operation.
Personally I generally favour the second approach or the fourth. It's a consistent change: when I want to catch an exception, I introduce a / block. The fact that it happens to be inside a  statement is neither here nor there. It ends up with more nesting, but I find it happens rarely enough that that's not a problem."
13.0,2010-04-04 23:09:13.993000+00:00,"What you seem to be looking for is called Homomorphic Encryption: an encryption scheme which allows you to perform operations on encrypted data, with the encrypted result as the outcome. 
Such a scheme would allow you to give encrypted data to a 3rd party, which could then do computations on it for you without knowing what they were computing.
In your case, you need two operations: addition and division. Until recently, homomorphic encryption schemes typically supported only 1 operation. But in september 2009 IMB announced the first fully homomorphic cryptosystem. Other researches published another system soon after that.
These cryptosystems might be be able to do what you want, but it is all cutting edge computer science research."
0.0,2011-06-30 11:47:24.023000+00:00,"Instead of ""max-width: 32%"", what if you put ""width: 100%""? If you want an image to fit it's container's width, you should put it's width as 100%. However, I can't visualize your layout properly, so this may not be what you are looking for."
0.0,2013-08-23 11:36:09.447000+00:00,"Ah that work, thanks. I was sure I was doing something silly :)"
0.0,2011-10-08 14:51:55.723000+00:00,"hi,thanks for your response.  I only included the code that had my service in it because I thought the rest was boilerplate.  the schema definition is indeed in my file and I have updated my question with the full file.  Thanks, P."
0.0,2012-08-17 07:05:32.123000+00:00,The part about 3 slash is what I want. Thank you.
0.0,2010-02-18 19:27:14.017000+00:00,"Ahhhh - I think this is what I'm looking for. I'll try it tomorrow, now I'll get for a Pizza an Beer. It's evening here..."
4.0,2017-09-22 02:19:35.357000+00:00,"@Kostadin: missed to answer this before... he doesn't  want to get all files matching a pattern, he wants to know if there is ANY"
0.0,2014-02-14 11:37:31.930000+00:00,You should edit your post and add the code for the rows and columns count.
0.0,2013-05-29 17:51:52.727000+00:00,"Ah, stupid me! I was combining the code from two posts, and commented on the wrong one! Thanks again :)"
1.0,2012-11-13 19:02:50.683000+00:00,I like `ISNULL` over `COALESCE`
0.0,2016-01-08 07:14:20.713000+00:00,"Hi all, may i know, why facebook login page display as blank n asp.net(4.0) in IE11? thanks."
0.0,2011-11-25 20:26:21.707000+00:00,"This works if the image is actually included in the project but fails when you include the file by using ""Add Existing Item"" then clicking ""Add As Link""."
0.0,2014-02-07 14:03:37.597000+00:00,"""IP works and hostname does not work"" - indicates there's a problem with DNS functions. You should check in that area. Do all hosts resolve to correct IPs. No conflicts/duplicates etc."
0.0,2016-06-01 18:15:35.643000+00:00,"Yes, I built on the earlier answer because it was not obvious to me how to properly override the `$log` service in a test.  As mentioned here, `$provide` must be injected using `module`."
0.0,2013-07-26 00:19:25.757000+00:00,Why is this marked as the accepted answer? ZVenue should provide an answer to his own question describing the WFNSRAON method and choose that one as accepted.
0.0,2012-01-11 13:08:12.867000+00:00,@larsmans: Does windows has any other system call which can replace fork() and sleep()?
0.0,2013-12-25 16:36:35.540000+00:00,My repository local path is correct: C:\User\user\m2\repository. But why maven did not download all described libs.
0.0,2019-02-06 03:51:32.213000+00:00,An implementation of this answer: [c# code to find corner vertex and calculate determinant of angle at that vertex.](https://stackoverflow.com/a/54546353/199364)
0.0,2012-08-11 22:34:28.020000+00:00,Just test it - add to global `var operableIds = Dictionary`- before call recursion's method and remove after. And if we have a ring when we add a object id into `operableIds` it is in dictionary.
0.0,2010-10-02 12:56:45.890000+00:00,"@Jon Hanna - does not (AFAIK), i will find an article proving that."
0.0,2012-02-07 14:12:40.010000+00:00,@canuckistani: Now if only `xhr` implemented proper `onload` and `onevent` properties ;) Web developers might be used to `onreadystatechange` but I consider it an ugly solution.
0.0,2014-03-03 08:21:42.013000+00:00,How can we know which is line number 168??? You Should to show some of your stack trace
0.0,2010-10-04 16:40:07.970000+00:00,"1 in 10 seems about right in my experience as well, maybe a little lower like 1 in 15 at my current job.  I think it would be higher if more people realized the could change it."
0.0,2012-07-09 23:51:31.090000+00:00,"Piece combination is probably the way to go. You'd have something like `if (pieceA.dependsOn(pieceB) && pieceB.dependsOn(pieceA)) combine(pieceA, pieceB);`"
0.0,2012-08-22 05:43:36.767000+00:00,@RMDan Learn something every day :)
0.0,2012-02-17 03:31:51.103000+00:00,"Thanks Jamie, that work for now!!   I tested only with 2 dataset, I will go to test with more now!!"
0.0,2010-06-23 03:49:35.480000+00:00,ok turns out that xcode doesnt like having the BASE_SDK set in the xcconfig file. if you totally remove it from build settings the dropdown doesnt ive you a choice what basesdk to compile against (simulator or device)
1.0,2010-03-21 00:14:59.787000+00:00,"It is, but the notion of a 'type' is much more mutable, since fields appear by usage rather than definition.  In this sense, Python is strongly typed, but the types themselves are subject to change.  This can be very powerful, but there are also advantages to working within a language with well thought out restrictions."
0.0,2011-12-02 07:12:31.130000+00:00,"I'm sorry but in VB.NET  i cannot do this things :
st = dc_card(ByVal icdev, cardmode, snr)
no like in VB6, i can write ByVal when calling dc_card function, but in VB.NET it's not allowed.
Now i'm passing to another method to finish this proeject. Thanks anyway fot your answer Mark :)"
