score,creation_date,body
0.0,2020-11-09 19:27:41.843000+00:00,"how are you?
I ask for help to be able to solve and solve this problem.
I'm making a Python program to send an array with 3 variables to an arduino with pyserial communication, the arduino returns this value to the python and on the screen requested the pressure value by the arduino. The outputs and inputs in the ardúino are the same and write the same things in the output of the requested value in Python but that does not happen, I have tried several ways and I know that the error is basically in the form that the data is sent in python and that it receives in arduino and also in the form of sending by arduino and receiving in python. What is in comment is what I tried to do to get the result
Usually the response received is b '\ x08' or 0 \ r \ n or 0
Below the codes:
PYTHON
Arduino :"
1.0,2020-11-03 08:09:16.213000+00:00,"I am using Fragaria Datepicker and Date range picker to display a date-range picker inline. I want to change the color of a specific date cell. I accept the date itself from another controller and, accordingly, by this date, I need to paint the cell.
How can I change the color of the date cell without going into the source code of the bootstrap-datarangepicker library?"
0.0,2020-11-12 10:29:14.980000+00:00,"I'm using  for integration of Vaadin Framework 14 and Spring Boot.
I would like to override the  and  methods of the  class to do the following things:
put stuff such as the current route / view path and current user ID into the SLF4J MDC in order to include it in each logging statement
log the duration of the request
In Vaadin 8 there was a  class which I could replace by simply annotating my custom subclass with .
This approach no longer works.  The  integration contains  which contains a direct call to the  constructor:
They should use a conditional bean here so we could replace it, but unfortunately they're not.
Just adding a custom  with a copy of the above code (but the constructor call substituted with my own) doesn't work, even with .
So is there a better way to do what I want than to exclude the whole vaadin-spring autoconfiguration and copy everything in my own configuration bean?  It works but I have to check if everything's still OK after each vaadin-spring upgrade."
0.0,2020-11-23 14:34:20.013000+00:00,"The following block of code is a loop intended to look for the value of  of  in  and return a value of  if found,  if not in . At the moment, it will error out if it cannot find the value:"
0.0,2020-11-23 18:05:22.647000+00:00,"I'm have an array of strings:
Is it better to check content with :
Or should I convert it to an object with the strings as fieldnames:
I'm getting the array only once, so I'm only converting to object once, but I'm checking for the strings repeatedly.
I'm thinking the  is  and field access is ."
1.0,2020-11-20 03:25:44.650000+00:00,"I need to remove the duplicates products field and keep the one with the lowest price
The result array that i want after the method is this:
Im trying to do something like this but it wont work"
0.0,2020-11-09 22:42:41.787000+00:00,"I want to change the textcolor using a custom style for my TimePicker preference but i can't seem to override the default theme.
Here is my theme resource file:
I'm using PreferenceDialogFragmentCompat and DialogPreference to create the custom TimePicker.
Here is the layout i inflate in the Dialog:
I tried creating a style but when i use it in the timepicker it doesn't gets applied.
How can i solve this?"
0.0,2020-11-29 08:21:30.957000+00:00,"I'm currently learning on Database Seeding in Laravel 8. When runnning the seed I got an error message
Class 'Database\Seeders\App\Models\Admin' not found
First I created migration database file called Admin.php in App\Models and I put these codes
After that I created a seeder called AdminsTableSeeder.php and put these codes
And finally on DatabaseSeeder.php I put these codes to call AdminsTableSeeder
After I'm done with all of those, I did composer du and trying to run the seed command but I got the error message.
EDIT
I already tried to modify the code from
to
But I stil got the error message like
Seeding: Database\Seeders\AdminsTableSeeder
PHP Fatal error:  Trait 'Illuminate\Notification\Notifiable' not found in C:\xam
pp\htdocs\tobacon_web\app\Models\Admin.php on line 11
Symfony\Component\ErrorHandler\Error\FatalError
Trait 'Illuminate\Notification\Notifiable' not found"
0.0,2020-11-22 19:28:38.347000+00:00,"I'm trying to upgrade to spring-boot 2.3.6. I'm using spring-data MongoRepositories, no difrect calls to MongoClient or MongoClient.
Getting exception:
Tried to customize
doesn't help, same exception.
What is the right way to customize UUID codec in spring-boot 2.3.6?
Thank you."
0.0,2020-11-27 16:25:41.590000+00:00,"I want to optimise the queries on my project and after many tentatives of using eager loading with datatables i just give up because there was no query reducing at all.
Anyway now Im trying to achieve that using , but the problem is that using  clause in  it gives me the following error:
This is how my code looks like:
I have tried many suggestion that i found searching for a solution but none worked. Can anyone tell how to achieve this using ?
EDIT: changed the order and putted  before  and error is still there. The error is on 's"
1.0,2020-11-11 20:53:55.740000+00:00,"Here is how you fix this.  -- Use the debugger.  Follow the code to see where the code flow is different than what you expect.  Then determine what fixes to make so that the code matches your design, or determine if your design is wrong and needs to be redone.  The bottom line is that a programmer, if they wrote the code themselves, *must* be able to diagnose their own code.  BTW, there is no way that any programmer, whether student or professional, could have written all of this code and *not* have the debugger ready to go."
0.0,2020-11-29 08:26:51.393000+00:00,@Jens I have updated my initial question to provide more context
1.0,2020-11-03 19:23:44.577000+00:00,`for(int ncpy=n; ncpy>0; ncpy--)` ==> `for(int ncpy=n-1; ncpy>=0; ncpy--)`
0.0,2020-11-06 12:44:42.433000+00:00,"thank you, but output1 is str and output2 is list, how to compare it then?"
0.0,2020-11-11 17:18:56.830000+00:00,"version of visual studio? VS2015+?  We've found it can usually be related to the TargetServerVersion defined on the project.  Right click the project in solution explorer, properties, `General` under Configuration Properties, option called `TargetServerVersion`. Change that to 2017 and redeploy."
0.0,2020-11-30 15:38:36.083000+00:00,Your rotation is off slightly: `x_bool = x_bool[-2:] + x_bool[:-2]`
0.0,2020-11-30 19:17:12.057000+00:00,"Oh, I need ti make a filter on the fieldname field40 for example. ""SELECT * FROM mytable WHERE ""(...) I saw many technics but not in this sublevel"
0.0,2020-11-13 15:50:10.137000+00:00,@pascalwhoop Could you show the code that reproduces this?
0.0,2020-11-14 13:54:49.390000+00:00,"That's it! The request is working now, I get a 301 first and then a 200. Now that I know this is the solution, it seems quite comprehensible. Thank you again for your efforts!"
0.0,2020-11-11 01:41:23.333000+00:00,Check it out here: https://output.jsbin.com/jerivotuta/1
0.0,2020-11-13 15:41:57.977000+00:00,@İrfan Sağdıç can your problem is solved or not??
0.0,2020-11-09 09:38:47.553000+00:00,@Arvo the TagName columns is 'nvarchar' datatype.
2.0,2020-11-17 12:35:04.220000+00:00,Do you have source for the COM class?
0.0,2020-11-18 13:15:34.140000+00:00,Seems it is not a good idea to have opportunity `fit` two bound piplelines independently. What if these two pipelines had being `fit` on different `DataFrame`s? If it can be done in python doesn't mean that it's a good idea for scala API. Python is more *dynamic* language and I think conceptually case with creating `Pipeline()` is abuse of this language feature.
0.0,2020-11-28 14:47:44.917000+00:00,"Please provide a sufficient reproducible input and expected output. Also, the `(10,)` and `(3,)` information you provide at the end doesn't match the code you have shared. Please be very clear and precise."
0.0,2020-11-25 09:28:12.007000+00:00,"do yoi habe another example where branch and school is not the same? btw, what have you tried and what does not work?"
0.0,2020-11-20 19:25:15.790000+00:00,That sounds like a reasonable solution! I've add the coordinates for the vectors in the post.
0.0,2020-11-03 11:49:25.137000+00:00,"Yes, and they don't provide any information regarding the queuing model. I need to know if it's M/M/1, M/M/S or .."
0.0,2021-01-13 10:05:41.850000+00:00,@Sneha Singh I did by the answer given below https://stackoverflow.com/a/65699614/10563627
0.0,2020-11-06 19:19:45.737000+00:00,"Ok, what happened to lead me beleive that this was cross database querying was a message from netcore stating I was not able to make cross database queries... but that was after removing ToListAsync() from the variable declarations at the top of the code. This code works, but without ToListAsync() its mad about cross-db queries. Either way, I understand what you are saying about these all being in memory once I create them as lists now, thank you for helping clarify!"
0.0,2020-11-20 11:22:34.827000+00:00,Thx but   Im not sure what the command would look like...
0.0,2020-11-12 15:52:28.450000+00:00,@jdweng do you mind to write it?
0.0,2020-12-01 11:12:52.263000+00:00,well … in fact there is indirect the Question what I did wrong :-)
0.0,2020-11-07 11:52:24.830000+00:00,If you add a `where` option to `include` you don't need to indicate an alias there along with fields used in a condition
0.0,2020-11-26 16:04:13.327000+00:00,"Additionally, if they're really in Pacific Time (and currently observing Pacific Standard Time) then -08:00 is the correct UTC offset, so I don't think any discrepancy *would* be due to DST."
0.0,2020-11-06 07:23:57.950000+00:00,"You state as a requirement that ""UserStatus = FORCE_CHANGE_PASSWORD"" but your program uses `contains`. Could you perhaps clarify what your actual requirement is?  Also, for future reference, it is usually a good idea to show the expected output.  See e.g. the [mcve] guidelines."
0.0,2020-11-12 19:22:54.433000+00:00,and perhaps writing it back to a file.
0.0,2020-11-02 18:38:36.320000+00:00,I tried to replicate the error but : https://repl.it/repls/SmoggySeashellObservatory#main.cpp  Maybe I'm missing something.
0.0,2020-11-02 15:17:47.180000+00:00,"Just tried this. `flock`  locks the file, so you can't write to it with  `file_put_contents`: _Warning: file_put_contents(): Only 0 of 22 bytes written_"
0.0,2020-11-06 15:42:30.117000+00:00,By converting the existing library to use `cv::Mat`. Support for `IplImage` has been removed.
0.0,2020-11-26 14:46:20.080000+00:00,"you can remove the quotes afterwards with `df['id'] = df['id'].str.replace(""'"", """")`"
0.0,2020-11-25 16:07:16.920000+00:00,See following : https://helpdesk.it.helsinki.fi/en/instructions/information-security-and-cloud-services/information-security/smime-encryption
0.0,2020-11-13 13:15:13.170000+00:00,Do you allow duplicate values in `Vakke` table because as your request says you will have duplicate with `Mathematics` and `Physical Science` for the same user ?
1.0,2020-11-02 12:36:29.437000+00:00,What does `obs` stand for?
0.0,2020-11-16 12:16:27.883000+00:00,Is your TLS cert (from certbot / LetsEncrypt) installed correctly? What do you get if you hit the non-websocket part of that server with a web browser? Please [edit] your question.
0.0,2020-11-25 14:02:58.797000+00:00,"Thanks for the input..But i have sorted out on that day itself, the issue was, runner ec2 instance was not able to be created."
0.0,2020-11-17 17:04:25.210000+00:00,"I did     System.out.println(positionOfSlash1+uRL.indexOf(""."")+1); I'm not sure if this is the right way to do it"
0.0,2020-11-03 13:33:42.633000+00:00,"I had to empty my pythonpath variable to avoid pycharm importing modules from that python location, but it's quite weird."
0.0,2020-11-07 23:18:57.380000+00:00,Is the problem is with all arabic text or specific when you render it letter by letter ?
0.0,2020-11-27 04:39:04.690000+00:00,"using `User::where(""status"", 1)` the status code changed to **302 Found** but when I check the response it says: **Failed to load response data**"
0.0,2020-11-18 01:52:34.310000+00:00,"Our goal is to allow customers to use a copy of the sheet without having to go thru the google authorization. We have started the process of verifying the app with google and we have read that there is an API key that is assigned to a published app and warnings about protecting the API to avoid unauthorized use.  Our application is an accounting spreadsheet for small businesses. The sheet has various scripts attached. The primary function of the scripts is to help the user enter data, categorize, and generate reports within the spreadsheet."
0.0,2020-12-01 14:37:28.210000+00:00,You are putting too much on regex. There are simply too many corner-cases to occur in an SQL query. I would recommend using a parser as well.
0.0,2020-11-11 13:19:27.243000+00:00,"I got it to work from the command line using ""mysqlsh --sql --uri=root@localhost -P 3307 --password=r00t"" but before, I was in the shell and it was failing. So what is the in-shell equivalent?"
0.0,2020-11-16 21:28:51.627000+00:00,Print `instance.instance_id` if you want the ID.
0.0,2020-11-18 06:57:46.270000+00:00,What you have there already actually works for me on the example you gave... `card.find_element_by_css_selector('h2.title')` returns the h2 element...
0.0,2020-11-03 16:39:18.057000+00:00,"Can you try this:
let button = fixture.debugElement.query(By.css('#view-rec'));"
0.0,2020-11-26 20:53:15.233000+00:00,"@Gyan, http://xk8.ru/f/temp/z.zip (resulting video is included, see it at ≈ 45 sec)... actually I need to use ZMBV codec but result is the same."
0.0,2020-11-10 16:12:39.953000+00:00,"Yes, that's called POM-less: with [`.mvn/extensions.xml`](https://github.com/howlger/IDEalized/blob/master/.mvn/extensions.xml) no `pom.xml` files are required per plugin/feature folder. Make sure to run Maven 3.6.3 and Tycho 2.1 with Java 11 or higher."
1.0,2020-11-09 23:19:52.463000+00:00,"Thank you guys but I managed to do the plots with ""ggplot(data = mydataset)"""
0.0,2020-12-01 01:05:34.340000+00:00,"@Jimi, thank you for your answer.`coordenada` is to get the last position in X of the object in Panel1, this is necessary to resize the Panel1 because Panel1 have more objects inside and need all pictures of this objects. Sorry `nameLine` its a mistake, I updated the code. The timer I dont know why doesnt increase. Taking the photo of that panel is because it is necessary to take the .PNG files to be able to insert them later in a file as evidence"
0.0,2020-11-06 12:39:45.317000+00:00,i tried that but the results shows empty string cause the sensor fault take some time to send the data
0.0,2020-11-19 13:39:40.153000+00:00,"No, it does not matter if there is `$` or not since your pattern is just optional. It is simply matches all the string from start to end, or the end of the string. So, when running `re.findall` that returns all matches, you get two. As usual, if you expect just one, use `re.search`."
0.0,2020-11-11 19:12:29.617000+00:00,Is a `TRIGGER` involved?
0.0,2020-11-09 09:24:34.210000+00:00,@lagbox solution plz
1.0,2020-12-01 18:26:09.823000+00:00,You can do the same as you did in excel.  A worksheet is a two dimension object with rows and columns.  So you can create a two dimensional object in c#.  I usually use a DataTable but you can also use List> or a dictionary.
1.0,2020-11-18 17:11:19.657000+00:00,The way it works right now is that the `name` is updated only if `Display Name` is directly modified. There's no such a thing as `firstName + ' ' + lastName`.
0.0,2020-11-02 13:17:08.220000+00:00,"But isn't that why I have this line in case the values do not match:
else if (p == null || q == null || p.val != q.val) {
      return false;
    }"
0.0,2020-11-08 22:27:14.807000+00:00,Run it as mqm not root.
0.0,2020-11-10 09:31:06.350000+00:00,"See, that's why I suggested to use Copy-Paste instead :-)"
0.0,2020-11-14 23:10:34.083000+00:00,"Check the [docs](https://discordpy.readthedocs.io/en/latest/api.html?highlight=publish#discord.Message.publish) and [this Discord article](https://support.discord.com/hc/en-us/articles/360032008192-Announcement-Channels-#:~:text=%F0%9F%8E%89%20Anytime%20you%20post%20an,who%20follow%20your%20Announcement%20Channel) on it."
0.0,2020-11-11 00:35:34.357000+00:00,Not everything has to be shoehorned into your lexer and parser. Patterns and constructs are there to serve your application. Not everything has to fit the pattern. Your parser just needs to make sure that you have all three tokens in the correct order. There's another stage beyond that which actually *consumes* the stream. That's where you'd discard whatever is not necessary.
1.0,2020-11-25 21:21:11.367000+00:00,It's not *odd* - it's *even* . But MSVC (VS2019) gives the same output; clang-cl gives `0`.
0.0,2020-11-12 16:15:09.180000+00:00,please show us your findings for the problem that you are facing. You can create a custom mapping to map list by using `@AfterMapping`
0.0,2020-11-13 05:30:49.840000+00:00,"There is no easy way to do this in WinForms. you'd have to keep a dictionary of bools and keep track of what keys were pressed. Or, you can import WPF runtimes and use `Keyboard.IsKeyDown` in combination with the `KeyDown` event. You could also resort to the Win32 API and using thing like `GetKeyState`"
0.0,2020-11-20 18:34:20.047000+00:00,"have you tried `between(String fieldName, Date from, Date to)`? It's in the docs at https://realm.io/docs/java/5.8.0/api/io/realm/RealmQuery.html"
0.0,2020-11-29 08:35:21.830000+00:00,https://css-tricks.com/snippets/css/a-guide-to-flexbox/
0.0,2020-11-24 16:34:46.770000+00:00,"Please edit your question to show the script you are scheduling. For testing, write the file to an absolute path, edit permissions to allow everyone r/w access to that path. Have a look in task scheduler if the scheduled job has actually run (Microsoft/Windows/PowerShell/ScheduledJobs). In your scheduled script, make sure to check for each possible error. On error, call `Exit 1`, which you will see as the task result in task scheduler."
0.0,2020-11-20 22:33:26.217000+00:00,"@CharlesDuffy, it is a lot slower. Can I nest ```with open()``` blocks?"
0.0,2021-02-11 13:35:20.683000+00:00,"Make sure you have swarm enabled:
`docker info | grep Swarm`  to check if swarm is active
if not use `docker swarm init ` to active docker swarm mode"
1.0,2020-11-05 20:48:49.083000+00:00,"You're not telling it to save it in a folder. By calling `open('ImgPath', 'wb')`, you're writing to a file named `ImgPath` in your current directory. If you want to save it to `save_fname`, then use that variable in place of the string `ImgData`."
0.0,2020-11-18 10:06:42.670000+00:00,"Why `1.10.5`? In your question, it seems like you have defined `1.8.5` in your Gemfile."
0.0,2020-11-25 16:13:45.490000+00:00,https://idownvotedbecau.se/noattempt/
0.0,2020-11-21 22:41:03.923000+00:00,Similar question: https://stackoverflow.com/questions/8177073/python-maximum-recursion-depth-exceeded
0.0,2020-11-06 00:52:26.927000+00:00,What problem specifically?
0.0,2020-11-30 11:37:27.570000+00:00,"@sergeykuznetsov yes, Site.js"
0.0,2020-11-25 05:19:41.230000+00:00,are you trying to publish an existing package with the same version that exist on npmjs?
0.0,2020-11-05 14:32:50.693000+00:00,Wanted to clarify that you would only sort on a single property at a time. That's how your question reads.
0.0,2020-11-12 20:00:06.847000+00:00,"I changed the if in arduino programation for while, thats works with numbers , but not bigger than 255"
0.0,2020-11-03 08:20:24.477000+00:00,how can I change the color of the date cell without going into the source code of the bootstrap-datarangepicker library?
4.0,2020-11-23 14:38:58.430000+00:00,"You can check to see if the variable contains a value after the `.Find` method. Something like `If ETLCell Is Nothing Then ...`. You can either exit the loop, or respond how you need if the variable is nothing."
0.0,2020-11-23 18:11:40.283000+00:00,I didn't realize javascript had a `Set`. An object is basically a `HashMap` and a `HashMap` of booleans is just a `Set` anyways right.
0.0,2020-11-29 08:30:18.640000+00:00,`App\Models\Admin::create($record);` to `\App\Models\Admin::create($record);`
0.0,2020-11-27 17:04:08.397000+00:00,@chegancasb Im sure it make sense because the last ```where``` condition is outside ```DB::raw``` and its refering to ```categories``` table and not to ```reviews``` table
