score,creation_date,body
0.0,2020-11-03 12:41:49.887000+00:00,"something weird is happening with my Pycharm setup. I have PYTHONPATH env var set on a python install location for other purposes, and all I want is to be able to create an isolated venv in Pycharm ignoring everything else happening outside of Pycharm.
But what I get is all the PYTHONPATH interpreter packages being appended to my virtual environment, and I can't uninstall them because they live outside of my venv.
How can I solve this?
Thanks"
0.0,2020-11-07 22:30:52.343000+00:00,"So I used this tutorial to make a typing effect and it appears great in English, I tried
to use Arabic text (which is a connected letter language) and it appears good on my device.
when I sent the app prototype for the client to test it, the Arabic language letters appear disconnected in his device! so weird as I couldn't debug it because it does not happen on my laptop and mobile phone!
I found this library which has a test demo at the bottom of the page, I asked him to test Arabic words on it, it appears like this on his device (iPhone xs max, chrome browser):
but it appears like this on my device (Linux, chrome browser):
any idea why this happens and how to solve it?"
1.0,2020-11-25 15:56:47.727000+00:00,"I am trying to retrieve data from database and display it into Data Table but this error is keep appearing:
When I tried to check its response in Developer tools (I use Chromium Edge) it does not have any data  and contains only message:
I have this in my :
My snippet code from controller file ():
My snippet code from the index blade file (jscript part at the bottom of blade file):
And finally where the data will be displayed (index blade file):
I don't know what's wrong or where's the part that causes an error or problem because it doesn't show any response or data.
When i try to display the contents of this line by using :
It does not show any data from database but when I try this code that does the same it retrieves data from the database but still the DataTable error is appearing:
I don't exactly know whether the data retrieval or data displaying
implementation or both is the problem.
What is the cause/s of the error/s or problem/s that results?"
0.0,2020-11-13 23:08:26.600000+00:00,"We have a complex Google spreadsheet with supporting Google App Script code. We are in the process of verifying the app with Google. Once the app is verified and published what is the best way to protect the API key? Also, once it's published what is the best way to protect the code?"
1.0,2020-12-01 13:32:31.940000+00:00,"I'm working with API that does not allow in specific scenarios to use &quot;OR&quot; or &quot;AND&quot; in queries.
So I have to split the query(String) and send one by one which is fine but it has to be with three brackets at start and end of the string, which is causing me troubles.
So the string I have to split looks like this:
API has built in methods that I have to use in order to send a query, above string should be separated in two and look like:
I'm not very familiar with regex, but I did try to remove all brackets to get clean string without them and then just surround String with 3 brackets from each side, which is not working well for obviously example 2, it deletes the brackets that surround IDs. So I assume regex is not the best solution, but I'm not really sure how to properly create parser for this. Any help would be nice!
EDIT:
Example of code with regex that is removing brackets:"
0.0,2020-11-11 12:58:09.873000+00:00,"I have a MySQL docker image running on Windows. I created it like this
and docker ps returns the ports as
When I go into MySQL shell and try to connect, I get an error. This is how I connect
If I am connecting wrongly, how should I connect in MySQL shell and should it work? Is there anything in my docker setup that would stop the connection working?"
-1.0,2020-11-16 20:06:23.260000+00:00,"I am trying to get the instance id of ec2 that I created. But I get 2 different outputs, why? Please check the print outputs.
Thansks."
0.0,2020-11-18 06:09:22.903000+00:00,"I am using selenium + chrome web driver to load a dynamic page:
Once the page is loaded, I want to get a list of all cards available on the page and then iterate through each card and get its title:
 seems to be a  method... I am not sure how to apply these selector to card (the type card is ).
Sample page:"
0.0,2020-11-03 11:00:12.990000+00:00,"I am writing karma/jasmine test case for the click event, but I am getting null for button. Please suggest me. Thanks in Advance.
component::
Html::"
0.0,2020-11-24 13:51:04.980000+00:00,"I was searching for a way to copy jenkins job with builds using API.
I tried few Python Wrappers:
but the copy methods in all of them copies the job without the builds."
0.0,2020-11-27 12:50:56.630000+00:00,"Is it possible to send emails from office365 graph api with just api keys, like sendgrid/twilio ?
I have looked up the documentation of Office365 and it feels like an oauth based (registering the application with urls etc) rather than just creating an api key. I would like to use it with curl commands in devops workflows."
0.0,2020-11-26 10:00:49.177000+00:00,"I want to create video from images (one image per frame).
When I watch resulting video I see (at least at the end of video) that frames are combined with each other (2 images on each frame overlaps with different transparency ratio). I seems like when source and destination frame rate mismatch.
I can remove  and  options but result will be the same (with 25 fps).
What's the problem?
How to fix it?"
0.0,2020-11-09 15:54:29.363000+00:00,"I have below 3 packages
eclipse plugin,
eclipse feature and
update site
Now I have to build eclipse feature in cli as same as right click over feature -&gt; Deployable feature -&gt; archive.zip . Tried with maven tycho but it is building jar not the archive file.
Otherwise I have to build update site in cli as same as open site.xml -&gt; Build all. Tried with p2 publisher but it is not creating contents.jar, artifact,jar, plugin and feature folders.
Please help me to automate the build in cli.
Regards,
Sunil"
2.0,2020-11-05 20:17:10.750000+00:00,"I am not really familiar with coding but I have to do an exercise where I have to plot all parameter values of a Monte Carlo run over the objective function.
Original wording of exercise :
&quot;Within R, produce so-called &quot;dotty-plots&quot; by plotting individual parameter values against the Reff values obtained in the 10,000 Monte Carlo runs&quot;.
The columns have each a different parameter name and for each row there is a different value, each parameter has 10000 values.
How can I dotty plot these parameter values over the objective function (which is also included in the data frame)?"
0.0,2020-11-30 19:55:14.143000+00:00,"I am developing a panel, which from time to time runs a process and generates an image within it. Once the image is generated, you need to take a photo to save it for the changes that are made.
I already developed the part where the images change, but when I take the photos, they all come out blank. Add a delay on the screen thinking that it should take a while to take the photo of the panel later, but it still comes out blank and if there is something inside the panel, since I am resizing it according to the size of what is updated.
Can you help me to see where my error is? Or guide me to obtain an optimal result?, I also tried using a timer, but it gives me the same result, any ideas?
This is the code developed."
0.0,2020-11-06 12:32:00.037000+00:00,"I have a DHT sensor and I used mqtt to send data to server. From there I displayed the data to a , so the span value is changing.
What I want to do is: When sensor stop working, it will display fault in that  and I want to display image only when its fault.
i tried to use JS to get the  then display image but its not working"
0.0,2020-11-19 13:16:05.017000+00:00,"I was doing some regex which simplifies to this code:
I was expecting it to replace  with  as the RE  matches the whole string, the engine should just return that and exit. So I ran the same regex with .
in the docs it says:
A|B, where A and B can be arbitrary REs. As the target string is scanned, REs separated by '|'
are tried from left to right. When one pattern completely matches,
that branch is accepted. This means that once A matches, B will not be
tested further, even if it would produce a longer overall match.
but than why is the regex matching an empty string?"
0.0,2020-11-11 09:19:34.497000+00:00,"I got an error
SQLSTATE[21000]: Cardinality violation: 1242 Subquery returns more
than 1 row (SQL: update  set  = 2,  =
'2020-11-11 09:02:27' where  = 85213835).
I'm using Eloquent ORM 5.7 and the the code is looks like this
Previously the code was running well and just got this error recently."
-1.0,2020-11-09 09:15:56.477000+00:00,"I am creating searching functionality in laravel it works fine for my first home page but when i am clicking on search and move on next page. In next page when i am searching the path became change and it will give error 404.. Why laravel route become change.
page load:autocomplete
After going to another page: productDetail/autocomplete,.../autocomplete what will do to avoid this situation.
Route:
js:
header.blade.php:"
0.0,2020-12-01 14:27:14.477000+00:00,"I'm using winform 4.7. on visual studio 2019.
First, I carry some documents like the electricity, gaz and leisure bills of person id 3, person id 4 and so on in 3 different languages.
I have a datagridview that gets its data from a sql table with columln 1 = id (that corresponds to the person id of my documents on my local computer). What i'm trying to do is: when I click on any datagridview's cell of the first column(the id's column), it opens a new form, ask me a choice between the language EN/FR/IT (I guess a listbox within the form), asks me the type of document, &quot;electricity bill&quot; / &quot;gaz bill&quot; / &quot;leisure bill&quot; and then build my output string with the answers I gave or clicked on. Let's say for example, I double cliked on the ID 3 within the datagridview, and selected &quot;English&quot; and &quot;electricity bill&quot; from the form that poped up. Then, it build a string which will ultimately be a hyperlink like this: C://folder/personId3_electricityBill_EN thats will give me the electricity bill of person 3 in english stored in my pc at this adress.
I worked on a prior project like this where I &quot;mapped&quot; each document in each language for each person in a spreadsheet and loop through it. But it was on excel...
Now I use a datagridview to display my data, and there isn't any other tab where I can map the things (for the better I guess).
Before I go anywhere, for what I want to do, is there a more efficient way using C# with a winform (maybe a mapping within a dictionary or any object) ?
Also, I found out that in the datagridview, either I can click on a cell and gets its value that can be a good starting point or I can directly change my entire column 1 in hyperlink cells.
What would be the best options ??
Thanks in advance for helping
UPDATE
After clicking one of the cells in the first column I make a new form pops up.
In my idea, this form will contain one listbox for languages, another for the document's type to get those inputs and build the string output with:"
-1.0,2020-11-06 10:36:08.390000+00:00,"I created a codesandbox that shows 3 formik fields: first name, last name, and name.
I'm trying to make the field  display  only until the user modifies the  field themselves, and so the condition  fails, after which the  field should not be automatically updated anymore.
The challenge is that I'm trying to make this code live in the  file since I need to be reusing that logic of inter-field dependency in other similar  components thereafter, and therefore reuse the &quot;generic&quot;  component without change."
1.0,2020-11-02 12:54:59.410000+00:00,"Question at hand: https://leetcode.com/problems/same-tree/
Can someone point out why my JavaScript solution can pass the test cases but fails during the actual submission?"
0.0,2020-11-08 18:50:39.753000+00:00,"I have script
in file 
I am running the  command in linux VM where I have installed IBM MQ version 9.2.0.0 as follows
I see the following output:"
0.0,2020-11-10 08:23:27.940000+00:00,"I have a sprite  sheet with country flags and code that puts the shape of a flag in each cell of a selection with two letter country codes.
This works well if i .Addpicture from an external .png file for each cell.
When i try to put the .png in an auxiliary sheet and .Duplicate flags from it, the flags are created in the sheet where the spritesheet is, no matter what I try. Stripped example below
How Can I .Duplicate a shape in a different Sheet?"
1.0,2020-11-14 22:42:33.787000+00:00,"I want to make my discord bot make an announcement to a certain channel, based on the Channel ID. But in different manuals I find only  and no comments how does it works and what is for discord.py an announcement channel. The problem is also that I need to shove in one command sending text to the channel where the command comes from and to another channel at the same time.
Instead of the last line, there should be a command that sends a specific message, preferably  to another channel whose ID I will indicate.
Edited:
Ok, got it, announcement channels can create only servers with enabled Community func.
Then another question, how I can do this without an announcement channel?
Edited: I'm add it like that:
And what i get it:"
1.0,2020-11-11 14:33:13.443000+00:00,"I am using NestJS and am trying to install Hot Module replacement, following this page's instructions: https://docs.nestjs.com/recipes/hot-reload
Since I am using Nest CLI, I followed the first part of the page. However, at the moment I have to use the  command, I get the following error:
Does anyone know where that could come from and how to fix it?"
2.0,2020-11-11 00:29:11.077000+00:00,"I am writing a parser for a custom file format constituted of an undetermined number of data structures spanning over multiple lines. The lines constituting each individual structure are garanteed to be contiguous, but can appear in any order. In order to be able to assemble the structure, the offset of the data in the structure on each line is written at the begginning of said line.
I wrote a lexer that produces 3 types of tokens : , , . But that means it is now up to my parser to discard  and  tokens, and rearrange the lines, which I feel like is not appropriate.
Should I instead write a lexer that produce only  tokens, representing the structures stripped of the offset and EOL and reassembled into the right order?
Edit:
If anyone happens to stumble upon this post, What I ended up doing is a classic lexer/parser which simply tokenize file and builds an AST, then I implemented an &quot;analyser&quot; that can work on the parsed data, rearrange it etc... &quot;Every man to his trade&quot;"
4.0,2020-11-25 20:51:59.337000+00:00,"The following code works.
My question is, should 2) not lead to a result very close to 1) ?
Why is 2) casted to such a small amount ?
Whereby, maybe worth to note 2) is exactly half of 1):
The output is:
18446744073709551616
9223372036854775808"
0.0,2020-11-12 16:11:57.250000+00:00,"I have a Spring Boot project and I'm using mapstruct to map 2 objects.
And I have this king of structure, this is the first object:
The second object:
And now using mapstruct I need to do this:
How can I do it? Any feedback will be apreciated! Thank you!"
2.0,2020-11-13 02:37:02.013000+00:00,"To catch the hot key , we can use following statement in .
To catch , we can use:
The question is how to catch the hot key like ?"
0.0,2020-11-20 18:30:10.267000+00:00,"realm between query for two dates not working
i have inserted data in realm like below
i m fetching data like below
above query returning 0 result but when change the query like below it return data
model class
Note:can anyone here please guide me what i m doing wrong here or give some link where i can find some date related crud operations. help really will be appreciated."
0.0,2020-11-29 08:21:23.643000+00:00,Will someone please help
0.0,2020-11-24 15:35:01.953000+00:00,"I am trying to schedule Powershell job to run my logging script every 5 minutes. The reason I don't use Windows Task Scheduler is I want it to run in background without Powershell window poping up. I checked Microsoft documentation here and tried following commands:
Job was created:
However the Job did not run. I know that, because my log file was not created. (The Script I run is working well). I wanted to check if there is powershell command for powershell scheduled jobs history but I did not find anything.
So I checked my Time string. &quot;24/11/2020 15:35:00&quot; This one is ok, because if I flip month and day then I get error.
So what am I doing wrong?
Edit 26.11.2020
So I did few recomended things. Firstly i made fairly simple script I will run with Powershell Jobs. (My Original Script is over 900 lines long and contains few work related data which i can not share.) My script contains:
Then I executed the commands as before now with different script.
I checked Task Scheduler as advised. Both Powershell Jobs (My original and Test) are listed but no record in Run History. (History is activated) Manualy Starting the task also does not work.
As before I also got in Powershell confirmation after creation.
The path is in this case real. I can run the script manually in Powershell with admin rights with this command:
With this said I am actually wondering whether the Powershell Jobs tool is blocked by execution policy.
So I did this:
I still can not successfully run Powershell Job."
0.0,2020-11-20 20:42:26.153000+00:00,"Update
It's throwing the error with a direct call now, and in the relations docs. I got rid of  altogether and just do this:
Also, it should be noted that the XML document (OSM) has all the node elements first, followed by the way elements, then the relation elements.
Original post
I'm writing to multiple JSON files from within Python , using  and . I call a separate function to write to the file.
This works for some of the elements/documents, but not all. It writes only so many then stops with . The last call to the file write method returns 207, but so do many of the previous calls. And, the next element looks normal:
Plus, it throws the error at a different element each time I try. And, it sometimes doesn't throw the error.
Stripped down Python:
Returns"
0.0,2020-12-02 19:49:50.960000+00:00,"I recently started in with docker and so far have had really good luck with the basics on singular docker servers. My issue comes when I try to use Docker swarm and specifically docker stack deploy --compose-file docker-compose.yml. I made a simple request (httpd image see below). If I launch this with docker-compose, I get the &quot;It works&quot; page. If I use it with the stack it says it is up and replicated, but I cannot get to it with any address in the cluser. Any advice would be great.
docker-compose.yml
In terms of troubleshooting:
I ensured the mapped ports were indeed opened on all my docker swarm nodes. I have gone back and used docker-compose to ensure that the system works as expected on a single host and it does. Finally I have ensured that my port mapping in the docker compose is correct and has no conflicts with any other container or port mapping. As I stated, I am rather new to docker and it SEEMS like it is working but I am just not hitting some small thing that prevents me from seeing it work right."
0.0,2020-12-02 15:15:09.597000+00:00,"Why is my bash code:
outputting:
I'd expect it to print:
This must be something super stupid, but as bash beginner I can't seem to figure out where it's going wrong."
1.0,2020-11-05 20:36:17.663000+00:00,"Hi I want to make a folder and save an image into that folder. Here is what I did but I get error:
Error:
'int' object has no attribute 'save'"
1.0,2020-11-18 07:14:44.367000+00:00,"I am getting this error after upgrading macOS to Big Sur, give me the suggestions to resolve this issue."
-3.0,2020-11-25 16:11:20.560000+00:00,"I have a table with string field like a|2$5.0| and I need to convert it to the following one a|5.0|5.0|.
I'm using SQL Server 2016.
The logic is as follows:
a - is the first character od each string
| - is a list elements separator
$ - if there is a $ sign in string, the element (value between $ and | signs) should be repeated as many times as the value of number preceeding $ sign (in my example 2 times).
String can be also more complex, but the same logic applies, eg.:
which should be converted to:
Any help will be appreciated.
Thanks in advance."
0.0,2020-11-03 13:28:02.387000+00:00,"I have a method on @change which recieve these values.
id could be any number, key could be: color, size, sex, etc..., value could be: red, 8, female, etc. In the first reception the values can be for example: , ,  and they change when the user select another option. For example:   , ,  or  , ,  ...etc
I want to dynamically fill an array of objects with the values this way for example.
I want to overwrite the values ​​if the key already exists for the same id. If it does not exist, it must be added for its id.
I hope I have explained clearly. Thank you very much for your time"
-1.0,2020-11-21 22:33:09.013000+00:00,"I have biuld a function in python that replicates a circuit of three other functions (defined in the main function) that call eachother while iterating over a given list of numbers required in the main function (In the code there is a way to break out of the recursion circuit). Basically this structure:
The problem I'm having is that if the list of numbers is larger than 500 values then this error appears:
I know I can change the limit of recursion but what does that mean, is my computer gonna be affected if I want to operate a list of half a million values?. The code inside the functions is quite simple and short."
0.0,2020-11-06 00:45:22.783000+00:00,"My app successfully can store the password in sqlite with hashlib.md5 encryption, but I do have a problem when I want to compare the input with the hash. Any help is appreciated!
UPDATE:
def chkPass(self):
Now I have both pass and the encryption but I'm still getting error.Maybe the encryption and decryption are not same type?
SQLITE HASH -
pass.input - 
I don't have any experience with encription. In sqlite the pass is store like: is that ok?
Here is the code that writes pas into sqlite"
-1.0,2020-11-30 11:21:38.030000+00:00,"I wanted to trigger some jquery action on an element but got an error. Console shows that here is an error:
But the thing is that I don't have this chunk of code in my js file at all..
My js:
Why does the console show js code which not exist in my js.file?
Btw document.ready function is not working (all jquery sources are linked properly), I noticed that this chunk of code is not shown in Console at all."
0.0,2020-11-19 19:17:52.283000+00:00,"I’m fairly new to Verdaccio. Been familiar with the tool for quite some time, but this is my first time trying to use it. I’ve installed it locally for the purpose of trying to figure out the right syntax for handling versioning, tagging and publishing a shared component library for work, but I’m having trouble getting this package published to my locally running instance of Verdaccio, and I’m struggling to understand why the publish command is failing. Was hoping someone here might be able to help.
First off, I should say that I have it installed and running locally, I can browse to http://localhost:7890 and see the Verdaccio web UI, and it says that I have “No package published yet.” That makes sense, because I haven’t been able to successfully publish anything yet. I’ve created a user with the  command, and then after that I ran the following command to attempt to publish to it: . When I run this command, I get the following error: “EPUBLISHCONFLICT … Cannot publish over existing version.”
Now, I can in fact see, when I look in  that there is a folder for the scope that I published with, and in that folder, there is a folder for the package that I apparently published, and it only has a  file in it. I’ve attempted to wipe this all clean, reinstall Verdaccio, etc, etc, nothing seems to fix the issue. I can’t seem to make this package go away, OR to get it to display in the UI either. After publishing (unsuccessfully), and despite the face that it says this version of the package exists, I still see nothing in the UI. It still just says “No package published yet”, which I still don’t really understand.
Any ideas would be appreciated. This has me pretty stumped. Thanks."
1.0,2020-11-05 14:09:38.053000+00:00,"Hi get the JOSN data dynamically, based on the JOSN will render data in the table. In the JSON nested objects come and those names and properties keys also dynamically. I need to sort based on the table columns up and down button action ASC and DESC. On button action, I get the property names to sort, that properties key names will be placed inside the nested objects or it might be in the upper level. How to identify and sort dynamically number, strings or dates. Greate appreciate.
Below logic, I have added only work for the Single level JSON objects, not nested level objects.
Below is the Sample Dynamic JSON data
From the below JSON, I have 7 columns, If I select the status column ASC/ DESC button, I get statusname property for the sort. it should traverse and sort nested JSON objects based on the key properties statusname. In case, if I select the Details column ASC/ DESC button,I get maindescription property for the sort. it should traverse and sort nested JSON objects based on the key properties maindescription."
