score,creation_date,body
0.0,2010-04-14 00:59:35.587000+00:00,"Solved. I'd been missing the obvious: the major difference between the active and inactive tabs is visibility, so adding :visible to the penultimate selector (for the tab divs) is all it took."
1.0,2010-01-07 17:33:58.807000+00:00,"This is an md5 hash of the entire binary contents of the file. The point is that if two files have different md5 hashes, they are different. This helps you determine whether a local file on your computer is the same as the file on the website, without having to download it again. For instance:
You downloaded your local copy somewhere else and think there might be a virus inside.
Your connection is lossy and you fear the file might be corrupted by the download.
You have changed the local file name and want to know which version you have. "
3.0,2013-08-23 11:35:03.580000+00:00,"You have two commata, but you only need one."
1.0,2011-10-07 21:08:20.323000+00:00,"are you not missing a
at the beginning of your  file?"
0.0,2013-03-20 03:39:04.607000+00:00,You could use the following:
3.0,2012-01-17 12:30:44.730000+00:00,"From RFC 1738 section 3.10:
A file URL takes the form:
where host is the fully qualified domain name of the system on
   which the path is accessible, and path is a hierarchical
   directory path of the form directory/directory/.../name.
So it's file:///path/from/root just like http://host/path/from/root because there's an implicit 'localhost' between the second and third slash. But as mentioned above, use Uri.FromFile() to build it."
1.0,2010-02-18 19:00:41.830000+00:00,You may also use this approach to increase readability and up to certain point independence from the implementation using a more common regexp subset
68.0,2014-08-11 14:26:39.137000+00:00,"If you're using .net framework 4 or above you could use 
This could be more efficient than using  since you  avoid iterating trough the entire file list."
1.0,2014-02-14 00:01:44.227000+00:00,"You should check the following two things:
1) Use generics for the Deque:
2) Ensure you overwrote the toString()-method in Level, so that the level returns its representation in a String similar to the one used in the constructor:
EDIT:
I think the main problem is, that the method which calculates the number of rows and columns of your field fails and therefor the initialization of the workerLocation-array in the Level-class is skipped. So if you try to access it the first time a Null Pointer Exception occures. Try to get the values of rows amd columns in the Level-class."
0.0,2011-03-24 09:21:55.943000+00:00,Here is a solution:
39.0,2010-03-08 11:26:25.080000+00:00,"Since you can't define a  directly in WPF, you need to obtain a , and add a hook to it :"
3.0,2012-11-13 18:56:58.593000+00:00,"To update table you can do this
And to select"
25.0,2013-11-01 11:45:32.137000+00:00,"There seems to be an issue with the new user agent string (most sites don’t recognize the new IE) and thus MVC doesn’t enable cookies by default 
Force the use of cookies in the authentication token by adding the cookieless attribute in your forms authentication element as follows
Source: http://botsikas.blogspot.co.uk/2013/09/ie11-and-aspnet-session-cookies.html "
1.0,2011-02-26 21:39:08.303000+00:00,"Look at SessionManager.m in the GKRocket example in the docs. Especially the implementations of
and"
1.0,2011-11-24 14:47:50.863000+00:00,The last URI should work with 'Resource' build action. Try code from this answer.
0.0,2014-02-04 18:58:15.390000+00:00,"Use !newstate! to get variable value, instead of  %newstate%. This is the way of getting delayed variables values. 
Keep using ""setlocal enabledelayedexpansion""."
15.0,2014-06-06 20:05:17.957000+00:00,"Thanks.  As mentioned, tests can inject  for  using .  For posterity,  is not available via  but instead must be injected into a function argument to :"
0.0,2012-04-17 18:00:00.920000+00:00,Instead of DateTime.Parse() try instantiating a new DateTime.
3.0,2012-01-11 13:06:23.277000+00:00,There is no  system call on Windows.
2.0,2013-11-25 07:23:04.290000+00:00,"The point of the problem is that you can't pass a list to your function. Your function wants an integer value.
As expected. So you should pass just a number (n) to your function to calculate fibonacci of it."
1.0,2012-12-11 15:15:58.067000+00:00,"If you are under IE you may have hit the 31 stylesheets limitation this browser has. Add a RadStyleSheetManager to your page to combine the requests in a single file. Confirm this by testing in Firefox or Chrome as well. Also, make sure your requests are ok, your stylesheets may not be present on the page in case you are adding them dynamically and something goes wrong with your code."
3.0,2013-12-25 15:39:58.453000+00:00,"Try to run  in your project root (where project  is located) via cmd. If succeeded, it will download all your dependencies into your local repository. Then you should search for maven repository configuration in netbeans options  and make sure that your local repository is added there."
1.0,2009-02-13 20:40:45.650000+00:00,"IIS, by default, runs your application within the default Application Pool. On 64-bit Windows, that Application Pool is, by default, 64-bit.
You should create a new Application Pool, and configure IIS to run your 32-bit website in your new 32-bit Application Pool."
45.0,2009-07-24 21:30:21.673000+00:00,"Find the vertex with smallest y (and largest x if there are ties). Let the vertex be  and the previous vertex in the list be  and the next vertex in the list be . Now compute the sign of the cross product of  and .
References:
How do I find the orientation of a simple polygon? in 
Frequently Asked Questions: comp.graphics.algorithms.
Curve orientation at Wikipedia."
-1.0,2010-09-29 11:24:35.387000+00:00,"You don't install fonts on your website, if you want the text on your site to show up in a non-standard font every visitor has to have it on their local machine.
It's easiest to stick to the standard fonts, and any small amounts of text you want in a special font you have to make as images.
If you are still not satisfied then have a look here: http://novemberborn.net/2006/12/sifr3beta1-110
Beware it is a mission!"
2.0,2012-08-11 21:55:24.043000+00:00,"I think you have a recursion's ring (infinite recursion), not a really stack overflow error. If you are got more memory for stack - you will get the overflow error too.
For test it:
Declare a global variable for storing a operable objects:"
0.0,2011-06-28 18:13:04.520000+00:00,"Take a look at the Pager example: http://jquery.malsup.com/cycle/pager2.html
The pager features takes the user to a specific image in the cycle, which is what you want to do.
However, you might only want to implement a single pager link, not a link for each image in the cycle."
4.0,2010-10-02 12:54:30.280000+00:00,"Good question.
From my (somewhat limited knowledge) of the ""under-the-hood"" working of a SQL Connection, many steps are involved, such as:
The Steps Under the Hood
Physical socket/pipe is opened (using given drivers, eg ODBC)
Handshake with SQL Server
Connection string/credentials negotiated
Transaction scoping
Not to mention connection pooling, i believe there is some kind of alogrithm involved (if the connection string matches one for an already existing pool, the connection is added to the pool, otherwise new one is created)
IDiposable
With regards to SQL Connections, we implement IDisposable so that when we call dispose (either via the using directive, or explicity), it places the connection back into the connection pool. This is in stark contrast with just the plain old sqlConnection.Close() - as all this does is close it temporarily, but reserves that connection for later use.
From my understanding, .Close() closes the connection to the database, whereas .Dispose() calls .Close(), and then releases unmanaged resources.
Those points in mind, at the very least it is good practice to implement IDisposable."
14.0,2012-02-07 08:18:02.670000+00:00," constructor isn't defined in the context of SDK modules. You can still get it using chrome authority however:
 documentation.
That said, your approach with  should work as well. You used the  operator incorrectly however, the way you wrote it a new ""require object"" is being created. This way it should work however:
Please consider using an asynchronous  object however, use  to attach your listener (the  module currently doesn't support other types of listeners or )."
0.0,2014-03-03 08:15:15.647000+00:00,"AS Vishrant mentioned *Java follows Zero indexing. So in your case question and responses array is of size 10 which means it will iterate from 0 to 9 *
in your tester class, you are trying to access 10th index in loop in 2 places
You should to write
EDIT Addition
}"
4.0,2010-10-04 05:16:53.580000+00:00,"I'm not sure if you've found much by way of google but this search bought up this page as hit 1: http://www.oreillynet.com/xml/blog/2006/03/more_statistics_on_user_clicks.html
Incidentally this question is on page one of the search too :)
Its from 2006, but the first bit has a little about the font size settings in IE.
I doubt there is any documented data for this specific thing. 
One thing I can tell you is that in over 10 years of working around computers I've seen about 1 in 10 users having a above default DPI setting. eg. 120 that caused the font size to be bigger than 16px in their browser. It also caused layouts that weren't styled properly to break."
2.0,2012-07-09 23:30:19.373000+00:00,"EDITED several times. I think this is all you need to do:
Find all the pieces that can only fall mutually dependent on each other and combine them into an equivalent larger piece (e.g. the  and backwards  in your picture.)
Iterate through all the pieces, moving them the maximum direction down before they hit something. Repeat until nothing moves."
4.0,2012-08-22 05:22:54.100000+00:00,"You have to escape the /'s in the regex code.
-EDIT-
ascii-lime also pointed out that you can change the delimiter to another non-alphanumeric character(with exceptions). To do this change the / at the start and end of the expression to the character of choice. Example:
to"
0.0,2012-02-17 02:58:22.920000+00:00,"The simplest answers are to change your queries for your datasets so they don't return multiple rows: combine the rows in your query.
The really simple version of this is to just wrap your existing query for Dataset2 in an outer Select ... Group By:
Slightly revised Dataset2:
A little bigger rewrite would give you:
Either of those queries above will work nicely with a lookup function.
But if your database1 and database2
are the same for all of the ten queries, then I would try to combine them. Maybe something like:"
10.0,2010-06-22 20:35:06.760000+00:00,"In an .xcconfig file, you can have 
Any build setting can be conditional on a number of things, for example the shortname for an sdk. The device SDKs are named iphoneos-4.0 for example, and sim iphonesimulator-4.0. The above thus gets you the 'foobar' as CFLAG for the device, and 'barfoo' for the sim.
To get started with xcconfigs quickly: 
New file > Other > Configuration Settings File
Open the project or target editor (cmd-alt-E for the target one)
Select a setting you want to customize (like cflags), and copy it with cmd-c
Paste in the new xcconfig file
Modify as above
In your project or target editor's lower right corner, select your xcconfig file as ""Based On"". 
Notice how the build settings UI now lets you edit the conditionals... You can create new conditionals with the lower left button, but it won't let you set ""iphoneos*"" for example, only specific versions.
Note that the magical $(inherited) lets you make a setting that inherits project settings but overrides just a part of it, like so:
I don't know a good resource for xcconfigs, but this'll get you started anyway: http://robnapier.net/blog/build-system-1-build-panel-360#more-360"
0.0,2010-03-20 20:19:19.413000+00:00,"I've found it helpful to work with different languages, since they each have their strengths.  Python is extremely powerful, but relies heavily on good coding conventions and practices to keep code maintainable.  In particular, it does not enforce type safety or insulation, which means it is easy to abuse.  C# is a modern object oriented language, with strong typing and other features to help enforce insulation and encapsulation.  It's not as wildly flexible, but I've also found that larger C# programs are much easier to maintain (especially when you inherit them from other developers.)"
0.0,2011-12-02 06:11:53.267000+00:00,"The Declaration for the dc_card Function should be:
You should be passing the icdev you got from the dc_init function, and the mode of 0, your information will be in the snr variable and the status will be in st.
in your declares:"
0.0,2013-10-22 17:00:22.030000+00:00,"Seems pretty straightforward to me.
This is simply a bool that returns true if the left mouse button is being held down in the current frame.
I think what you really want to do is when they move the mouse while the left mouse button is down so you simply need to check both conditions:
I assume you already have code to check if the mouse moved (comparing the old position to the new position)."
0.0,2013-03-31 17:01:33.460000+00:00,The proper thing to do would be to make this a stored procedure at the database and have your C# run that sproc.
0.0,2011-08-29 15:22:31.083000+00:00,"It seems it doesn't sort very well... 
But you can easily make it sort ok:"
2.0,2011-05-17 02:25:29.393000+00:00,"I don't think that WPF is actually that hard. I think it's just that WPF definitely requires a slightly different way of thinking. You can tell that it was built with certain principles in mind (like MVVM, as another poster mentioned), and it's very different from most other frameworks. If you try to do it like you did Windows Forms or MFC or ASP.NET or whatever... you'll struggle. You need to be willing to change your mind on how things work.
Frankly, I think the only way to learn it is with experimentation. Come up with some side project to work on using WPF and try your hand at it. Learn a bit and refactor it. Get a good book, read the WPF disciples list, read anything that Sacha Barber writes, read the WPF section here on SO.
When you have your first ""ah ha!"" moment where you decide to write an Attached Property to solve some obscure problem you're having, you'll know you've finally understood it :)"
0.0,2013-03-06 08:26:55.957000+00:00,What's the meaning to catch OutOfMemoryError and do some work in your catch block if your heap space or perm gen space is full? Actually You cannot guess where can this exception actually happen. There is no logic to catch this exception.
1.0,2014-05-09 19:48:53.540000+00:00,or you might just want to enter date
3.0,2010-11-09 02:09:42.907000+00:00,"I think that when it comes down it, it it really depends on your target audience. If you know that your target audience is most likely to have JavaScript enabled, then so be it.
I have a situation at work, however, where I know that some of the people I develop for may be using old browsers and whether I like it or not, I cannot force them to upgrade.
You also want to consider allowing your site to be accessible to all platforms and browsers and this includes audio and text based browsers. It's possible that your site will be inaccessible to people with disabilities. 
Whether that's important enough for you to develop a non-JavaScript version of your site, that's up to you."
4.0,2014-02-05 08:35:44.877000+00:00,"There is no problem with the map projection, but the tiles are cut according the TMS notation (with tile [0,0] in the bottom left) in GDAL2Tiles.
Some tools expect the Google XYZ notation (with tile [0,0] in the upper left corner).
The tiles are otherwise equal, they have just flipped Y coordinate in the file name.
Have a look at this:
I prepared a website which shows visually the difference and also explains the problem. Have a look at:
http://www.maptiler.org/google-maps-coordinates-tile-bounds-projection/
There is also a source code for how the tiles and all coordinates are calculated. It is part of the GDAL2Tiles which you mentioned above - which is a code I created some years back.
Your second question is was about MBTiles. The mbutil utility has a parameter ""--scheme tms"" which allows to create the MBTiles file from tiles rendered with gdal2tiles.py.
GDAL reads just the KAP file, where each represents a map in the sheet (in case there are insets).
BTW Do you know that there is http://www.maptiler.com/ which solves the problems mentioned above directly? You can just drag&amp;drop into the GUI or pass on the command line the KAP file as it is and choose whether you want tiles in directory or MBTiles and it will directly render the output. The tiles are directly optimised as well, there is support for rendering multiple input files into a single layer and rendering is of magnitude faster then with GDAL2Tiles. "
3.0,2013-01-25 16:35:37.657000+00:00,"This is NOT guaranteed. It is for a SortedDictionary&lt;>, of course, and also for arrays and lists. But NOT for a Dictionary.
Chances are, it will be stable if the dictionary is not changed - but it's just not guaranteed. You have to ask yourself - do you feel lucky? ;)"
1.0,2009-06-10 03:53:47.430000+00:00,"Check out http://activescaffold.com/  and Streamlined -- http://streamlinedframework.org/
both support nested models on a page.
Note that you probably need some training for your users. A 4 level deep model is not something that people run into every day."
0.0,2012-02-25 00:47:48.393000+00:00,
0.0,2014-07-11 09:31:55.560000+00:00,You can redirect in  like this
3.0,2009-08-30 17:17:27.243000+00:00,"ok, this should show you can really get another category of numbers with other aproaches ...
the limit here is not the number of stars, the limit is density, i.e. the number of stars visible at the same time ... with text disabled, i can get up to 700 @ 30fps, on a Core2Duo, with quite a recent version of the debug player ...
i realized, flash player is not very good at clipping ... and that actually, using the most simple way, you spend a whole lot of time moving around objects, that are far from being visible ...
to really be able to optimize things, i chose to use MVC here ... not in the classic bloated way ... the idea is to handle the model, and if any elements are visible, create views for them ...
now the best aproach is to build up a spatial tree ... 
you have leaves, containing objects, and nodes containing leaves or nodes
if you add an object to a leaf and it surpases a certain size, you turn it into a node with nn leaves, redestributing its children between 
any object added to the background will be added to a grid, determined by the object's coordinates ... grids are created just-in-time, an start off as leaves
the big advantage of this is, that you can quickly isolate the visible nodes/leaves.
in each iteration, only the nodes/leaves which either turn visible, or are already visible (and may become invisible), are interesting. you need not do any updates in the rest of the tree. after finding all the visible objects, you create views for objects that turn visible, update the position of those that simply stay visible, and destroy views for objects that become invisible ...
this saves an awful lot of everything ... memory and computation power ...
if you try with a huge world size (100000), you will see, that you run out of RAM quickly, long before CPU does anything ... instantiating 500000 stars uses 700MB ram, with about 50 stars visible, running at 70 fps without any tremendous CPU usage ...
the engine is just a proof of concept ... and code looks awful ... the only feature i am currently proud about is, that it supports object to occupate a certain area, which is why an object can be part of several leafs ... i think, this is something i will remove though, because it should give me a great speed up ... you also see, it stalls a little, while adding stars, which happens, when leafs flip to nodes ...
i am quite sure, this is not the best way for a spatial subdivision tree, it's just that everything i found seemed kind of useless to me ... probably someone who studied (and understood) CS, can refine my approach ... :)
other than that, i used an object pool for the views, and Haxe, since it performs better ... a thing that probably is not so clever, is to move all the views individually, instead of putting them on one layer and moving that around ...
some people also render things into s manually, to gain performance, which seems to work quite well (just can't find the question right now) ... you should however consider using  instead of  ...
hope this helps ... ;)
edit: i decided to turn my detailed answer into a blog post ... have fun reading ... ;)"
1.0,2014-02-27 06:43:54.350000+00:00,"Client side javascript validation is not manditory. It just prevents the client (whose JS is enabled) to submit or reload the page. Server side validation is the most important as JS validation can be bypassed by simply turning off JS. The JavaScript Validation should never be relied alone. 
The PHP Validation (server Side Validation) is robest &amp; cant be manipulated by the client. If its not implemented, you may end up with worse data &amp; more worse will be SQL Injection. So in practive we tend to use both JS &amp; PHP validation together "
4.0,2013-03-05 17:06:31.817000+00:00,"Yes, you're missing something
You should try testing your server with something else than a full-blown web browser. try  for example.
Chrome does a lot of other things than doing what you told it to do."
0.0,2014-08-29 16:05:10.117000+00:00,"You are doing couple of things wrong here.
Don't leave exception blocks empty. It hides all the error. Use Log.e to print that.
Don't use System.out.println. Use Log.* only for logging. 
Don't use AsyncTask to upload your file. Use IntentService Instead. And using localbroadcastmanager broadcast upload events for your activity to listen. It will be more configuration change friendly.
Instead of doing all this file upload sorcery yourself. Use httpmime library instead. It works simply awesome on android. I have my apps on production using this. Something like this you have to do.
You will have your everything in 'response' for you to read.
From here you can download this library http://repo1.maven.org/maven2/org/apache/httpcomponents/httpmime/4.2.5/"
6.0,2010-10-29 20:43:04.993000+00:00,"perl6 is still a work in progress, so even though perl6 has much improved support for functional programming at the language level (see perlgeek.de on currying in perl6, for example), you'll probably want to start now with perl5 so you can get to work with what's out there. i recommend looking into cpan for higher-level library support...Array::Utils and others (there's a lot!)"
1.0,2011-08-07 00:41:34.960000+00:00,"Did you check permissions/owner?
From the PHP manual: Note: The results of this function are cached."
0.0,2012-11-05 12:01:48.007000+00:00,Try this: 
2.0,2012-11-26 05:27:06.513000+00:00,"Try this:
EDIT
http://blog.gerv.net/2006/10/firefox_reload_behaviour/ read the article and first comment by Jason"
1.0,2013-07-26 22:06:23.810000+00:00,"Use operator.itemgetter:
Outputs:"
0.0,2014-05-19 12:46:48.720000+00:00,"I think your problem is that you are not separating your items, so your SQL ends up looking like:
Whereas what you would really want is 
If you are using SQL Server 2008 or later then I would recommend using table-valued parameters. The first step would be to create your type:
I tend to just create generic types that can be easily reused, but this would be your call.
Then in your method you would need to split your values into an array and add them to a datatable:
You can then add this table to your command as a parameter:
Finally, You can reduce your code by just initialising the SqlDataAdapter with your SQL and connection:"
0.0,2013-06-04 14:19:22.393000+00:00,"Try setting a 'default' , so no gradient for IE10"
33.0,2012-01-30 16:46:58.090000+00:00,Search path is indeed what you want:
2.0,2013-06-15 18:53:50.053000+00:00,"Below is a simplistic, and perhaps slow, example of counting individual letters (and some other characters) in a document.
Change to 
to display the characters themselves.
It may be possible to use  (somehow) to count occurrences of characters; otherwise it would require Regex.
Alternative using Replace:"
0.0,2011-12-21 07:37:34.373000+00:00,"You need to make some form of path with a list of points, and then move the ""pencil"" from the first to the last.
Read about linked lists in java, it's easy and everything will be clear. The only problem is making the path. You might have to write some tool in your pc to transform images into paths.
Another way to achieve this effect, but a bit bolder, is to pick random points in the edges of the picture, sort them, and then move the pencil from the beginning to the end."
1.0,2013-08-13 15:07:17.870000+00:00,"Totally failed to actually write the link in the comment. Here are some tips for speeding up your site: https://stackoverflow.com/a/16240746/1037489 And of course, the prebuilt version is the one to use, should be much faster. Click-to-build command is your friend. Make sure you have a source enlistment to be able to use it. "
5.0,2011-06-06 06:21:33.720000+00:00,"No there is problem with throwing a  array. Just that you should receive as,
1st  is to add ability to receive any  array    
2nd  is to specify that  is not intended to change within  block"
5.0,2013-05-28 18:30:36.443000+00:00,"This is a generic method (based on another SO answer which I can't find) which you can call on any enum.
By the way, the Browsable attribute is already defined in System.ComponentModel.
For example:"
