score,creation_date,body
0.0,2011-06-28 20:31:49.323000+00:00,"I am *trying* not to.  However ""the issue I am seeing is that Apache appears to matching the www subdomain of afewguyscoding.com immediately and not examining the additional URL behind it. Changing ServerAlias does nothing. For example, using my setup, if I enter davidheartsrachel.com, I properly reach my wedding website. However, if I use www.davidheartsrachel.com, I reach my other website, my software development business.""  Mixing them is the only way I can properly get it to work.  I am trying to get them to work without mixing them."
0.0,2012-09-23 12:34:21.093000+00:00,Those are both methods of performing Ajax.
0.0,2014-07-30 02:22:51.773000+00:00,"Thanks so much, this is working for me using latest PG."
0.0,2012-01-20 04:00:29.850000+00:00,"I tried that, does not work. `start` is a feature of the cmd console and not a file you can execute. I also tried `cmd /c start vlc`. Works, but then I see the cmd console instead of the vlc console. not a solution either :("
0.0,2010-06-24 23:34:14.220000+00:00,Why the IOStreams FUD? I have yet to see a case where any speed limitation was an issue because any I/O device you're referencing with it is usually the bottleneck. Use the various streambuf classes if you need to be closer to the metal.
0.0,2013-06-02 17:28:32.407000+00:00,"Yes, the mutex should be an Object() instead. buy I did not get how would I synchronize the producer thread. How would moving out the producerRunnable cause the sync. on producer thread to happen?"
11.0,2012-06-12 12:05:47.510000+00:00,"I would like to mention that `managedQuery` is now deprecated. If somebody developes the app for Android API 4 and higher, add support library v4 and use this code: `CursorLoader loader = new CursorLoader(context, uri, projection, null, null, null);
    Cursor cursor = loader.loadInBackground();` instead of `Cursor cursor = managedQuery(uri, projection, null, null, null);`"
2.0,2012-12-21 15:36:13.677000+00:00,"Possible problem with this approach is that since the data is coming in over a COM port, it is likely coming from another computer which may or may not be using the same environment (or even the same OS for that matter)."
4.0,2011-10-06 17:04:18.110000+00:00,"Not at all. Not everyone developes web applications or overdesigned GUIs with memory-managed develomepent systems which run on high-end systems with gigabytes of RAM, and you can allow a small integer to use kilobytes of memory. Even today, there is need for systems where the entire hardware cost for the embedded electronics must be under 1$. For such firmware, every byte counts even today."
0.0,2012-03-01 17:52:32.903000+00:00,"Thanks, Mark.  I have tried this, yet it seems to be pulling every bin and not limiting the bins to the specific partnums.  I'm trying:
`
     `"
0.0,2014-11-16 11:51:33.033000+00:00,"Or could it be ""a new and fast contour filling algorithm, Ren & Yang "" ?"
0.0,2014-03-07 14:00:06.660000+00:00,It did help but i am not only looking for that but also a good technique here to redirect to secure section of website. Now I have heard headers are not that good option though I can make sure that permissions for the secure section being redirected through headers are changed so that the world can not execute it still if a better approach is there please help.
